sentence	control	dementia
There are two children and their mother in the kitchen.	 I'm not sure what to do with them, she said, adding: I don't know if it's a good idea.	 I was a little girl, but not so much of it as she had no idea about what to do with her husband's name is that they were just one or more than any other: I don't know how many people have been told by my father (or at all). So you can tell your own family
The little boy has climbed up, on a three legged stool to get some cookies from the jar in the cupboard.	 I'm not sure if it's just me or him, he says with an exasperated look at his friend who is standing by and watching as they take their first bite of cookie dough before heading out for lunch later that afternoon. You know what? I don't think we should be doing anything like this right now because there are so many other kids around here! The two boys start talking about how much better life would have been without them but then suddenly realize something else: They	 It's not so much of it as I had no idea about what he was just one more than any other thing and that is how you can't have an even better- or worse for me at this time (I've been too long since my first day but now we're still there with all those who are already here! The only two things: The last few people will be like a because they were never really good enough...
The stool is about to fall over, so he’s probably going to fall on the floor.	 I don't know if that's a good idea or not. I think you're right, she said with an exasperated look in her eyes and then looked up at him as though it were some kind of joke—she had never seen anything like this before! He turned his head away from me while looking down into my face for what seemed almost imperceptibly long time	 The first time I was a little bit of an old-time and it's not too much more than just one or two (and that you can be very good at this point in your life as we have been out for quite some years now but there are no longer things like I'm still here because they've got back up! The last year has always had
His sister is holding up one hand as if she is waiting for him to pass her some of the cookies, and she’s holding a finger to her mouth as if to warn her brother to be quiet.	 I don't know what you're talking about, he says with an exasperated look on his face; but I'm not going anywhere without your help. He looks down at Elsa's shoulders in disbelief that they are still so far away from each other after all this time spent together—she has no idea how long it would have been before their relationship had ended or even whether there was any way Anna could ever get back into love again.[1][2] It seems like every single person who knows Kristoff can see through these words: They've never met anyone more beautiful than them! And yet…they both seem very much alike...[3]. The only difference between those two people? Their personalities were completely different (even though	 She's not so much more than just about any other things that I could have been in my head but it was all too long ago when you were he had an even longer time with his face on this day (I can't know how many people are still there now because they've never seen me before or at least once every 2-and then 1/2 times 3:
Meanwhile their mother is taking no notice.	 I don't know what's going on, she says, looking at her son in the eye as if to say: 'You're not a good boy.' I tell him that he should be ashamed of himself for being so young. What do you	 It's not only a few of them, but they are the most important things that I have to do with this one thing: I don't know what you think about it and so many more than any other people who would be in your life as if we were
She’s been doing the washing up and is now drying a plate.	 I'm not sure if it's just me or something else, but she seems to be getting better at her job as well. I don't know what you're talking about, Harry said with an exasperated look on his face when he realized that there was no way they could possibly have known	 I'm not going to do it, but I don't know what you are we have done in this way that's no more or less than just one of those two things (the first three-takes: a little bit too much for me as they've got outdone with their own
She has left the tap running and the sink is overflowing.	 I'm not sure how long it will take me to get out of here, but at least we'll be back in a few hours or so. I don't know what you're talking about, she said with an exasperated look on her face as they walked away from their apartment complex where he was staying	 It's not only one of its own, but a few other things that I have been in this place for some time (I don't know how long it takes to get out there are no more than two or three-and they can be just as many people who would say it when you think about what we
There is a big puddle on the floor, and she’s standing in it.	 I don't know what to do about that. I'm not sure if you've ever seen her before, he said with an exasperated look at his wife's face as they walked out of their apartment building into downtown Los Angeles' Sunset Strip neighborhood just after 9:30am this morning (	 The first time I had to see what's there are two more than one of those who have been so many things that we can't be seen as if they were not at all but when you're still with me (the second). The only thing was an I ama which has no idea
She seems not to have noticed either the water or what her children are doing.	 I don't know, she says, but I've never seen anything like this in my life.	 It is a good thing, but I don't think of it as if she's an even better than any other (I can see that in my own child and no one at all: the best. The only two-pony has been on this for so many years The first time we've seen how they're done with their kids!
She might be looking out of the window, which is open and looks out on the garden.	 I don't know if it's a good idea for her to look at me like that because she'd probably get hurt or something. I'm not sure what you're talking about, he said with an exasperated tone in his voice as we sat down beside each other near my bedside table (he had been sitting there all day long). He looked up from our conversation without saying anything more than one word	 The first time I've been a little more than an hour or two hours but it's not so much as you can't have to see what they're doing in your house (or at home) The second half-day that was just one day for me!
You can see a path and another part of the house and the lawn, flowers, and a tree in the garden.	 It's not like you have to go through all that stuff, he told The Associated Press. You just walk around.	 The first time I was an old-fashioned (I think it's not so much more than one or two but that is what we have been for many years to be seen by some people who are just as they've had no idea at all their own good ideas: a little bit too long ago. The other things like this were you know how far back then! But there has never really come up with any kind words on your mind when talking about
It seems to be summer, as she is wearing a short sleeved dress under her apron.	 I don't know if it's because of the weather or not. She looks up at me with an expression that I have never seen before in my life and then turns away from us without even looking back for some time after we've been talking about what happened last night (she has no idea how long this was going on). What do you mean? What did they say	 I have been in the last few days and it's not so much more than just about any other things that would make me feel like an over-sized little girl who has no idea of what we are all my own ideas for how you can do with this one thing: I don't know (or at least something else. The only two or three if they're both
Her son is wearing shorts a shirt and shoes and socks, which are also falling down.	 He says he has no idea what's going on in the house or where his father was last night.I don't know if I've ever seen anything like this before, she told The Daily Caller News Foundation via phone from her home outside New York City Tuesday morning after being informed by family members that their daughter had been taken to an emergency room for treatment of head injuries sustained while fighting with police officers who were chasing him around	 I have been in the game for some time but I am not being able to get out of it at all times (the last two games so many more than just about every other things that you can be seen as an in-game when they were playing with their own hands on this one!
Her daughter is wearing a short skirt and T-shirt.	 I don't know what to say, she says, looking down at her hands in the air as if they've just been wrapped around each other's shoulders for an hour or two.She looks like I'm going through some kind of emotional rollercoaster right now with this whole thing	 I'm in the back of my head, but I don't know if it's not too long for me to be on the other side. (a little more than one or two at this time when you're going out with your own body parts that are just as well
There are lots of cupboards all around the kitchen.	 It's a great place to go if you're looking for something new.	 It's a great place to go, but I can't be too much for this one and it is not so many more than just about every other things that we have been in my life (I'm sure you're gonna get some new stuff! But what do they've got out there? 
There are two cups on the draining board.	 The first one is a small piece of plastic that you can use to hold your water bottle in place, but it's not really necessary for this tutorial because we'll be using an old-fashioned wooden spoon instead.) The second cup comes from our kitchen	 It is a good thing to do, but I don't think of it as if you're not an good and that's we have no idea at all (I've never had any ideas about what they did in my first one-and there was
