sentence	control	dementia
There are two children and their mother in the kitchen.	 I'm not sure what to do with them, she said, adding: I don't know if it's a good idea.	 I don't know what to do with you, but I'm not sure that she's a good or whatever it is going on me because of my own? (and) You're all right now! You've got her back from your friends who has no idea about how much money they should be able
The little boy has climbed up, on a three legged stool to get some cookies from the jar in the cupboard.	 I'm not sure if it's just me or him, he says with an exasperated look at his friend who is standing by and watching as they take their first bite of cookie dough before heading out for lunch later that afternoon. You know what? I don't think we should be doing anything like this right now because there are so many other kids around here! The two boys start talking about how much better life would have been without them but then suddenly realize something else: They	 I'm not sure what you're gonna do when I say Hey hey, but it's just because of my own personal interest and that we've been talking about how much time they'll be doing their business with me (which is an actual person) or someone who doesn't have any real reason for being there at all! And then she said something along those lines as if this was your job? She says: 'you know' You can see through her face-toed
The stool is about to fall over, so he’s probably going to fall on the floor.	 I don't know if that's a good idea or not. I think you're right, she said with an exasperated look in her eyes and then looked up at him as though it were some kind of joke—she had never seen anything like this before! He turned his head away from me while looking down into my face for what seemed almost imperceptibly long time	 I'm not sure if it's a good idea of how much you should be and what? I don't have any reason at all because they both are just fine (and) but we're right now that she has no problem with her life or anything else in this case as well. She was already dead for some time when i've been there too! And then again
His sister is holding up one hand as if she is waiting for him to pass her some of the cookies, and she’s holding a finger to her mouth as if to warn her brother to be quiet.	 I don't know what you're talking about, he says with an exasperated look on his face; but I'm not going anywhere without your help. He looks down at Elsa's shoulders in disbelief that they are still so far away from each other after all this time spent together—she has no idea how long it would have been before their relationship had ended or even whether there was any way Anna could ever get back into love again.[1][2] It seems like every single person who knows Kristoff can see through these words: They've never met anyone more beautiful than them! And yet…they both seem very much alike...[3]. The only difference between those two people? Their personalities were completely different (even though	 I'm not doing anything at all because it's just so I don't do something wrong in my head (if you'rein'a) or even more than what they've done on their own lives! And now that there are no other people who will ever have any idea about how much money we can make from our current economic situation? We'll find out soon enough when things get really bad but this time around…
Meanwhile their mother is taking no notice.	 I don't know what's going on, she says, looking at her son in the eye as if to say: 'You're not a good boy.' I tell him that he should be ashamed of himself for being so young. What do you	 In the past few years, I have been able to see that she was a little bit more than just about every other thing in my life (I don't) The first time we are not very much and even though he's only if you're all of course
She’s been doing the washing up and is now drying a plate.	 I'm not sure if it's just me or something else, but she seems to be getting better at her job as well. I don't know what you're talking about, Harry said with an exasperated look on his face when he realized that there was no way they could possibly have known	 I'm not sure if it's going to be good or bad, but we're just saying I don't do anything wrong. The only means that you should have done everything right?
She has left the tap running and the sink is overflowing.	 I'm not sure how long it will take me to get out of here, but at least we'll be back in a few hours or so. I don't know what you're talking about, she said with an exasperated look on her face as they walked away from their apartment complex where he was staying	 I'm not sure what to do with this, but I think it's a good place for my own house or something that will help me (or whatever) If you've got some of your home in which they're gonna go back down there are going away from where? You can't tell her off if she
There is a big puddle on the floor, and she’s standing in it.	 I don't know what to do about that. I'm not sure if you've ever seen her before, he said with an exasperated look at his wife's face as they walked out of their apartment building into downtown Los Angeles' Sunset Strip neighborhood just after 9:30am this morning (	 I don't know what I'm going to do with you or how much of my life (and) but if they're not doing anything at all! — that's just because we've got some good for me as well—you'll get your money back home when he was out there after his
She seems not to have noticed either the water or what her children are doing.	 I don't know, she says, but I've never seen anything like this in my life.	 I don't know, but I'm sure that she's got a little bit more than we're just one of our kids and it was all because they were talking about how many people in which is We'll be going for (1/2) 1 2 3 4 5 6 7 8 9 10 11 12 13 14 15 16 18 19 20 24 25 26 21 17 23 22 33 28 34
She might be looking out of the window, which is open and looks out on the garden.	 I don't know if it's a good idea for her to look at me like that because she'd probably get hurt or something. I'm not sure what you're talking about, he said with an exasperated tone in his voice as we sat down beside each other near my bedside table (he had been sitting there all day long). He looked up from our conversation without saying anything more than one word	 It's a good time to get some fresh air in your home or something that you've been doing? You can't do! You're not working at all (you'll work) - I'm just going for my own house/myself ) I = +1+2-3=4*5^6 * 1 2 4 5 6 7 8 9 10 11 12 14 15 16 18
You can see a path and another part of the house and the lawn, flowers, and a tree in the garden.	 It's not like you have to go through all that stuff, he told The Associated Press. You just walk around.	 It's time to get into your home or something that you've been doing? You should be working at all (and) when it is! You're right now - I don't do anything for me if we are not going on my money...I'm gonna go ahead with this thing because they have no idea about how many people who will ever know what their own personal financial success has brought us down from heretofore known as the other side
It seems to be summer, as she is wearing a short sleeved dress under her apron.	 I don't know if it's because of the weather or not. She looks up at me with an expression that I have never seen before in my life and then turns away from us without even looking back for some time after we've been talking about what happened last night (she has no idea how long this was going on). What do you mean? What did they say	 I'm not sure what I'll do in the future but it's just because we're going for me and my life or something that will happen (or whatever you've done)
Her son is wearing shorts a shirt and shoes and socks, which are also falling down.	 He says he has no idea what's going on in the house or where his father was last night.I don't know if I've ever seen anything like this before, she told The Daily Caller News Foundation via phone from her home outside New York City Tuesday morning after being informed by family members that their daughter had been taken to an emergency room for treatment of head injuries sustained while fighting with police officers who were chasing him around	 I don't know what I'm going to do with my life or how long it will take, he says in the You're not doing anything at all. He's saying that you've done nothing but she'll be working out of your own money (or whatever) You can see this as if they both have been there for quite some time!
Her daughter is wearing a short skirt and T-shirt.	 I don't know what to say, she says, looking down at her hands in the air as if they've just been wrapped around each other's shoulders for an hour or two.She looks like I'm going through some kind of emotional rollercoaster right now with this whole thing	 I don't know what to say, but I'm not sure if she's in the end of my life or how long it will be (or whatever you think about me) then we're going for her? We'll have no problem with our lives at all because they've
There are lots of cupboards all around the kitchen.	 It's a great place to go if you're looking for something new.	 It's been a long time since I've seen anything like it, but this is an interesting thing to see if you can't just go back and look at least I'm not quite sure about how many more than we're going for (1/2) 1 2 3 4 5 6 7
There are two cups on the draining board.	 The first one is a small piece of plastic that you can use to hold your water bottle in place, but it's not really necessary for this tutorial because we'll be using an old-fashioned wooden spoon instead.) The second cup comes from our kitchen	 This is a great way to make sure that you don't have any problems with your phone, but it's not working at all (or) I've got some of my money and I'm just because they're in their own business as well! 
