sentence	control	dementia
There are two children and their mother in the kitchen.	 I'm not sure what to do with them, she said, adding: I don't know if it's a good idea.	 I'm not sure if it's a good or bad thing to do, but we're talking about something that has been going on for quite some time now). The problem with all of this is you don't know what your child will be doing when they get home from school (or at work) as well), so
The little boy has climbed up, on a three legged stool to get some cookies from the jar in the cupboard.	 I'm not sure if it's just me or him, he says with an exasperated look at his friend who is standing by and watching as they take their first bite of cookie dough before heading out for lunch later that afternoon. You know what? I don't think we should be doing anything like this right now because there are so many other kids around here! The two boys start talking about how much better life would have been without them but then suddenly realize something else: They	 I'm not sure if it's good or bad for her but she is so much better than me and we've been friends ever since that moment when you're sitting down at home with your kids all day.) She was just like I don't know what this means. And then there were those two-year olds who said they'd never heard of my name because their parents had told them about how great these things are! They would have laughed out loud (or giggled) as well
The stool is about to fall over, so he’s probably going to fall on the floor.	 I don't know if that's a good idea or not. I think you're right, she said with an exasperated look in her eyes and then looked up at him as though it were some kind of joke—she had never seen anything like this before! He turned his head away from me while looking down into my face for what seemed almost imperceptibly long time	 I don't know if that's a good thing or not but it makes me feel like an idiot when you're doing something stupid and say I'm sorry in front of your face. So what does this mean? Is there any way we can stop him from falling off his feet without getting hit by someone who has no idea where they are). And how do
His sister is holding up one hand as if she is waiting for him to pass her some of the cookies, and she’s holding a finger to her mouth as if to warn her brother to be quiet.	 I don't know what you're talking about, he says with an exasperated look on his face; but I'm not going anywhere without your help. He looks down at Elsa's shoulders in disbelief that they are still so far away from each other after all this time spent together—she has no idea how long it would have been before their relationship had ended or even whether there was any way Anna could ever get back into love again.[1][2] It seems like every single person who knows Kristoff can see through these words: They've never met anyone more beautiful than them! And yet…they both seem very much alike...[3]. The only difference between those two people? Their personalities were completely different (even though	 I don't know what you're talking about, he says in an exasperated tone that makes me feel like I'm not even listening.) You've been here all day.
Meanwhile their mother is taking no notice.	 I don't know what's going on, she says, looking at her son in the eye as if to say: 'You're not a good boy.' I tell him that he should be ashamed of himself for being so young. What do you	 I'm not going to tell you how many people have been killed in the last few days, but it seems like a lot of them are still alive and they're getting ready for some good news on that front. I don't think there's any reason
She’s been doing the washing up and is now drying a plate.	 I'm not sure if it's just me or something else, but she seems to be getting better at her job as well. I don't know what you're talking about, Harry said with an exasperated look on his face when he realized that there was no way they could possibly have known	 I'm not going to tell you what it's like, but there are so many things that can be done in this area of your life—I've never seen anything quite as good or better than my own personal experience with water-soluble soap.) But if we're talking about water soluble here
She has left the tap running and the sink is overflowing.	 I'm not sure how long it will take me to get out of here, but at least we'll be back in a few hours or so. I don't know what you're talking about, she said with an exasperated look on her face as they walked away from their apartment complex where he was staying	 I'm not sure if it's a good or bad thing, but there are some things that you can do to make your life easier for those who don't know what they're talking about in this blog post.) I've been working on my own project since last year (and still have no idea how much time
There is a big puddle on the floor, and she’s standing in it.	 I don't know what to do about that. I'm not sure if you've ever seen her before, he said with an exasperated look at his wife's face as they walked out of their apartment building into downtown Los Angeles' Sunset Strip neighborhood just after 9:30am this morning (	 I don't know what to do about that, he told me as we sat down at his desk.) I'm not sure if you've ever heard of her or how many other people have been killed by this sorta thing—it's just an interesting question for someone who has never had any experience with
She seems not to have noticed either the water or what her children are doing.	 I don't know, she says, but I've never seen anything like this in my life.	 It's just a matter of time before she gets back home, and I don't know how long it will be until we get there.
She might be looking out of the window, which is open and looks out on the garden.	 I don't know if it's a good idea for her to look at me like that because she'd probably get hurt or something. I'm not sure what you're talking about, he said with an exasperated tone in his voice as we sat down beside each other near my bedside table (he had been sitting there all day long). He looked up from our conversation without saying anything more than one word	 I'm not sure if it's a good or bad thing to do in this case but at least we're talking about something that makes you feel more like an idiot than someone who doesn't really know what they are doing.) I've never been so happy with my own life (or lack thereof) as long-term caretakers for some reason). It was just too much fun when she came home
You can see a path and another part of the house and the lawn, flowers, and a tree in the garden.	 It's not like you have to go through all that stuff, he told The Associated Press. You just walk around.	 It's just so much fun to look at, he told The New York Times. I've never seen anything like it.
It seems to be summer, as she is wearing a short sleeved dress under her apron.	 I don't know if it's because of the weather or not. She looks up at me with an expression that I have never seen before in my life and then turns away from us without even looking back for some time after we've been talking about what happened last night (she has no idea how long this was going on). What do you mean? What did they say	 I'm not sure if it's just me or the fact that we've been talking about this for some time now.) She looks like an old-school girl who has never had sex before (or even once), and you can't help but wonder what kind of life will come after). And then there are all these other things going on in your head: I think they're really good
Her son is wearing shorts a shirt and shoes and socks, which are also falling down.	 He says he has no idea what's going on in the house or where his father was last night.I don't know if I've ever seen anything like this before, she told The Daily Caller News Foundation via phone from her home outside New York City Tuesday morning after being informed by family members that their daughter had been taken to an emergency room for treatment of head injuries sustained while fighting with police officers who were chasing him around	 I'm not sure if he's going to be happy about that or whether it will make him feel any different from the rest of us who we've been in this room for so many years (I don't know what you're saying), but at some point they'll all go away). But then there was one other thing she said: You have no idea how much time has passed since your father died. She didn
Her daughter is wearing a short skirt and T-shirt.	 I don't know what to say, she says, looking down at her hands in the air as if they've just been wrapped around each other's shoulders for an hour or two.She looks like I'm going through some kind of emotional rollercoaster right now with this whole thing	 I'm not sure if she's going to be happy about that, but it makes me feel like we're in the middle of an argument with each other.
There are lots of cupboards all around the kitchen.	 It's a great place to go if you're looking for something new.	 I'm not sure if it's a good or bad thing to do, but you can't go wrong with that either.) I've been using this for some time now and have never had any problems in my life (which is pretty rare). It works great as an extra-large dish
There are two cups on the draining board.	 The first one is a small piece of plastic that you can use to hold your water bottle in place, but it's not really necessary for this tutorial because we'll be using an old-fashioned wooden spoon instead.) The second cup comes from our kitchen	 I'm not sure if this is a good idea, but it would be nice to have some sort of water in there so that you don't end up with an empty cup or something else). I've been using these for years now and they're
