sentence	control	dementia
There are two children and their mother in the kitchen.	 I'm not sure what to do with them, she said, adding: I don't know if it's a good idea.	 , but they have a little more than any other people to do not so that it is no one of what I think about how much like I don't even if you can be very good for them as well or at all on this time when we know there's he has been done by those who would say
The little boy has climbed up, on a three legged stool to get some cookies from the jar in the cupboard.	 I'm not sure if it's just me or him, he says with an exasperated look at his friend who is standing by and watching as they take their first bite of cookie dough before heading out for lunch later that afternoon. You know what? I don't think we should be doing anything like this right now because there are so many other kids around here! The two boys start talking about how much better life would have been without them but then suddenly realize something else: They	 It's and it was not only one of that he had no more than any other people who have been there is very good for all they are at this time with them as if you can't know how many things like I am I think about what would be done by those two or even when we could say's but also do so much better then after these same thing which will tell us here 
The stool is about to fall over, so he’s probably going to fall on the floor.	 I don't know if that's a good idea or not. I think you're right, she said with an exasperated look in her eyes and then looked up at him as though it were some kind of joke—she had never seen anything like this before! He turned his head away from me while looking down into my face for what seemed almost imperceptibly long time	 I can be a little more than any other things that are not just as they have no longer and it's in this way of making them less like an even if you don't know how much better or what we all these people who will do with their work for one day after another thing which has been done by some very long time when there was at last year but now its
His sister is holding up one hand as if she is waiting for him to pass her some of the cookies, and she’s holding a finger to her mouth as if to warn her brother to be quiet.	 I don't know what you're talking about, he says with an exasperated look on his face; but I'm not going anywhere without your help. He looks down at Elsa's shoulders in disbelief that they are still so far away from each other after all this time spent together—she has no idea how long it would have been before their relationship had ended or even whether there was any way Anna could ever get back into love again.[1][2] It seems like every single person who knows Kristoff can see through these words: They've never met anyone more beautiful than them! And yet…they both seem very much alike...[3]. The only difference between those two people? Their personalities were completely different (even though	 I have been in that he has no more than it was not only two or three times when they are at this time with his wife who will tell me about how many things like I don't do you can see what we all these people on their own so much better then get out from there's by saying:
Meanwhile their mother is taking no notice.	 I don't know what's going on, she says, looking at her son in the eye as if to say: 'You're not a good boy.' I tell him that he should be ashamed of himself for being so young. What do you	 , and the fact that they are not to be in a I have been made by this year-in' as well for all of what I said it was an's (the only one can't even if you know how much more than any other people
She’s been doing the washing up and is now drying a plate.	 I'm not sure if it's just me or something else, but she seems to be getting better at her job as well. I don't know what you're talking about, Harry said with an exasperated look on his face when he realized that there was no way they could possibly have known	 I think about it's, but they are not to be in their own that he has no one of what you can do have done by them with some other things like this time or even if we know how much more than all these people who will get out from there was just as well for many times when
She has left the tap running and the sink is overflowing.	 I'm not sure how long it will take me to get out of here, but at least we'll be back in a few hours or so. I don't know what you're talking about, she said with an exasperated look on her face as they walked away from their apartment complex where he was staying	 It's, but I have been a little to be there are not so that it can't even if you know how much of what they do in their own with no more than any other things like I think about this was just as well when we see all these two or some people who would say he could go on
There is a big puddle on the floor, and she’s standing in it.	 I don't know what to do about that. I'm not sure if you've ever seen her before, he said with an exasperated look at his wife's face as they walked out of their apartment building into downtown Los Angeles' Sunset Strip neighborhood just after 9:30am this morning (	 I can be very easy to do not so that you have no one of all they are at this time for them as if he has been done by other than when there will make him with his own an even more or some things like how many people who know about what was doing their work which would get from
She seems not to have noticed either the water or what her children are doing.	 I don't know, she says, but I've never seen anything like this in my life.	 It is a lot, and she has no more than any other people of that they do it's in their work for them as if you can't be at all about how many things like I am I was done by those who would say so when he had been on his wife with him there were some one said this man could get out from being very well but then after having an old woman will come
She might be looking out of the window, which is open and looks out on the garden.	 I don't know if it's a good idea for her to look at me like that because she'd probably get hurt or something. I'm not sure what you're talking about, he said with an exasperated tone in his voice as we sat down beside each other near my bedside table (he had been sitting there all day long). He looked up from our conversation without saying anything more than one word	 It's in a way to look like that you would not just as if it could have been there are more than any other things about what I think they can't know how many people who were going into their own all these two or even when we see this one thing for example where he has an I'm with his name was from some time but now so much less then say something else why do go back
You can see a path and another part of the house and the lawn, flowers, and a tree in the garden.	 It's not like you have to go through all that stuff, he told The Associated Press. You just walk around.	 In this is not only to be made by one or other than that are as they have no more for their own it's (and also has an even if you know how many things like in' with some people who do what I said 'I don't think about all these same thing we've been told me when he was on his wife she had come from her husband would tell him there were two men could say:
It seems to be summer, as she is wearing a short sleeved dress under her apron.	 I don't know if it's because of the weather or not. She looks up at me with an expression that I have never seen before in my life and then turns away from us without even looking back for some time after we've been talking about what happened last night (she has no idea how long this was going on). What do you mean? What did they say	 I have been in the last night and day with no longer than it was on this morning at 6th of 7: I am not long time for my wife has said that we are you will come from 3-day 5/2 2nd 1st i had an early evening after 4 hours before 9 or 10am late afternoon when he would like 8 thi's work by his office
Her son is wearing shorts a shirt and shoes and socks, which are also falling down.	 He says he has no idea what's going on in the house or where his father was last night.I don't know if I've ever seen anything like this before, she told The Daily Caller News Foundation via phone from her home outside New York City Tuesday morning after being informed by family members that their daughter had been taken to an emergency room for treatment of head injuries sustained while fighting with police officers who were chasing him at	 I can be seen in the same as they have been worn by other than that was not only one of this time to wear on his pants with no more like he has it's (I think about how many people from all these two or even if you don't know what we will look for men who would do get their own clothes but then take them at home where there were some women could go back when she had her
Her daughter is wearing a short skirt and T-shirt.	 I don't know what to say, she says, looking down at her hands in the air as if they've just been wrapped around each other's shoulders for an hour or two.She looks like I'm going through some kind of emotional rollercoaster right now with this whole thing	 I have the same as if they are not to be in this, but it's that she has no longer than I can't even when you know how much more of what he was about her being an old man with his wife who had been on for many years long time from before
There are lots of cupboards all around the kitchen.	 It's a great place to go if you're looking for something new.	 I have a lot, and even if you can be used to make it is not only for this way more than any other things like that they do in their own or just as well but with no one thing about how many people who don't know what's work on them so much better then when
There are two cups on the draining board.	 The first one is a small piece of plastic that you can use to hold your water bottle in place, but it's not really necessary for this tutorial because we'll be using an old-fashioned wooden spoon instead.) The second cup comes from our kitchen	 I have been made by a little, and it is not only to be used for this way more than any other things like that they can't work as if you know how much of what we do in all these people who would say I think there's
