sentence	control	dementia
There are two children and their mother in the kitchen.	 I'm not sure what to do with them, she said, adding: I don't know if it's a good idea.	 I have a lot of things to do, but it's not so much more than they can be done with my own little girl who has no idea about what she is for her daughter (I don't know how many other people like that one or another will make up there as well because you're too far from them
The little boy has climbed up, on a three legged stool to get some cookies from the jar in the cupboard.	 I'm not sure if it's just me or him, he says with an exasperated look at his friend who is standing by and watching as they take their first bite of cookie dough before heading out for lunch later that afternoon. You know what? I don't think we should be doing anything like this right now because there are so many other kids around here! The two boys start talking about how much better life would have been without them but then suddenly realize something else: They	 It's not so much more than that but it is just one of them and they have been there for about half an hour or two hours (and I don't). The only thing you can be at all four-hour long time: I've never had any other things with me; no matter how many people are we'd by my own time as well! And now what? How did he was his/had anything else besides those who were even if He could make him
The stool is about to fall over, so he’s probably going to fall on the floor.	 I don't know if that's a good idea or not. I think you're right, she said with an exasperated look in her eyes and then looked up at him as though it were some kind of joke—she had never seen anything like this before! He turned his head away from me while looking down into my face for what seemed almost imperceptibly long time	 I think that it's not a good idea but I don't know how much of this and if you are just go down for an even more important one or two-and then they will be up in my house (or at any other place as well because we have been there too long time with no way out from here.
His sister is holding up one hand as if she is waiting for him to pass her some of the cookies, and she’s holding a finger to her mouth as if to warn her brother to be quiet.	 I don't know what you're talking about, he says with an exasperated look on his face; but I'm not going anywhere without your help. He looks down at Elsa's shoulders in disbelief that they are still so far away from each other after all this time spent together—she has no idea how long it would have been before their relationship had ended or even whether there was any way Anna could ever get back into love again.[1][2] It seems like every single person who knows Kristoff can see through these words: They've never met anyone more beautiful than them! And yet…they both seem very much alike...[3]. The only difference between those two people? Their personalities were completely different (even though	 She has not been in any other hands or at all but with his face that he was held down by an eye-witnesses have no more than when they are hold on their own eyes (and it's)
Meanwhile their mother is taking no notice.	 I don't know what's going on, she says, looking at her son in the eye as if to say: 'You're not a good boy.' I tell him that he should be ashamed of himself for being so young. What do you	 The only one of the other two, and a third (the first) are all three: I'm not even The second in which they both have to be taken as well; but I don't take any more than four or five for this time
She’s been doing the washing up and is now drying a plate.	 I'm not sure if it's just me or something else, but she seems to be getting better at her job as well. I don't know what you're talking about, Harry said with an exasperated look on his face when he realized that there was no way they could possibly have known	 I'm not going to do it, but I don't have any idea of what you are done in this way so that we can get some ideas about how much more than just one or two (or three if they're all together with each other; for at least as well-and then there's
She has left the tap running and the sink is overflowing.	 I'm not sure how long it will take me to get out of here, but at least we'll be back in a few hours or so. I don't know what you're talking about, she said with an exasperated look on her face as they walked away from their apartment complex where he was staying	 It's a small, but not so much of it as you can't be able to have more than just about any one or two (or at least three if they are in all The only thing that I've been there for quite some time since my last post-I was on this very long ago when we were
There is a big puddle on the floor, and she’s standing in it.	 I don't know what to do about that. I'm not sure if you've ever seen her before, he said with an exasperated look at his wife's face as they walked out of their apartment building into downtown Los Angeles' Sunset Strip neighborhood just after 9:30am this morning (	 The first time I have to stand up with her (the second one of my two-t he has been there for about an hour or more than three hours but not so long as you can be at all times when your feet are no longer that's they're still sitting down from this place where their
She seems not to have noticed either the water or what her children are doing.	 I don't know, she says, but I've never seen anything like this in my life.	 It's a lot of other things, but I don't know if she has been noticing anything at all; and that it is just one more important thing for which we can be very much less than when they're having done with their own little bit in-between (I've had no idea about how far from them as well because there was nothing else. The fact: they being able
She might be looking out of the window, which is open and looks out on the garden.	 I don't know if it's a good idea for her to look at me like that because she'd probably get hurt or something. I'm not sure what you're talking about, he said with an exasperated tone in his voice as we sat down beside each other near my bedside table (he had been sitting there all day long). He looked up from our conversation without saying anything more than one word	 I have no idea what to do with this one but it's a very good thing for that I'm not so much more than just about two or three (or at least an in-the other; if you can't see how many things are they're all done up there as well because we've got them both by their own way: a has been too far from those who get off
You can see a path and another part of the house and the lawn, flowers, and a tree in the garden.	 It's not like you have to go through all that stuff, he told The Associated Press. You just walk around.	 The next door is an open-up with one or two other trees that are not to be seen by any person who has been there for some time (or more than others; but only if you have had them as they were at all times when it was on their own place. and so I could never know how far from what we do, he told me this morning after my last night's long before his first day which will make him come
It seems to be summer, as she is wearing a short sleeved dress under her apron.	 I don't know if it's because of the weather or not. She looks up at me with an expression that I have never seen before in my life and then turns away from us without even looking back for some time after we've been talking about what happened last night (she has no idea how long this was going on). What do you mean? What did they say	 I have been in the same place for some time but I am not so long and it's on one of my other two or three different places (the first). The last was an all-time with no more than four at least; this has also had me being worn out by about five times when they are wearin' them: a little overstuffed because that
Her son is wearing shorts a shirt and shoes and socks, which are also falling down.	 He says he has no idea what's going on in the house or where his father was last night.I don't know if I've ever seen anything like this before, she told The Daily Caller News Foundation via phone from her home outside New York City Tuesday morning after being informed by family members that their daughter had been taken to an emergency room for treatment of head injuries sustained while fighting with police officers who were chasing him around	 I have been in the water for some time as I am not having any of these things to be worn by my wife's husband (and pants) but with no one or two more than just about three-the other people who can wear them at all times when they don't go out on their own clothes so that you know what it means: a little bit too much.
Her daughter is wearing a short skirt and T-shirt.	 I don't know what to say, she says, looking down at her hands in the air as if they've just been wrapped around each other's shoulders for an hour or two.She looks like I'm going through some kind of emotional rollercoaster right now with this whole thing	 The first time, I was in the back of my head to see if she's still on her left side (I'm not with me). The last one or two other people who have been at least three times since they've had no more than four for their right hand as well
There are lots of cupboards all around the kitchen.	 It's a great place to go if you're looking for something new.	 It's a great place to make it, but not so much as you can't have any more than one or two and that is very good for your own house (the other). I think about how many people who will be in there at least if they're just like those with no-one
There are two cups on the draining board.	 The first one is a small piece of plastic that you can use to hold your water bottle in place, but it's not really necessary for this tutorial because we'll be using an old-fashioned wooden spoon instead.) The second cup comes from our kitchen	 The first and second, I have a lot of other things to do in this game but it's not so much more than just one cup (I don't think about that too many or less then as you can be very good at all these games
