sentence	control	dementia
There are two children and their mother in the kitchen.	 I'm not sure what to do with them, she said, adding: I don't know if it's a good idea.	 I think it's a good thing, but I don't know what to do with this or if they're not doing anything at all. If you have done something else then let me go for my time of (1) = + 1/2 / 2. If You Have Nothing To Do It All
The little boy has climbed up, on a three legged stool to get some cookies from the jar in the cupboard.	 I'm not sure if it's just me or him, he says with an exasperated look at his friend who is standing by and watching as they take their first bite of cookie dough before heading out for lunch later that afternoon. You know what? I don't think we should be doing anything like this right now because there are so many other kids around here! The two boys start talking about how much better life would have been without them but then suddenly realize something else: They	 I'm so sorry that I can't do this but it's just because you've got me out of my money and if i have not been paid for any reason (i)
The stool is about to fall over, so he’s probably going to fall on the floor.	 I don't know if that's a good idea or not. I think you're right, she said with an exasperated look in her eyes and then looked up at him as though it were some kind of joke—she had never seen anything like this before! He turned his head away from me while looking down into my face for what seemed almost imperceptibly long time	 I'm not sure if it's a good but I don't know how much you're gonna be in my opinion and what i think of your opinions or just because its an idea that would have been more than something like me (i) which has no real value at all except for this one thing: 1 2 3 4 5 6 7 8 9 10 11 12 13 14
His sister is holding up one hand as if she is waiting for him to pass her some of the cookies, and she’s holding a finger to her mouth as if to warn her brother to be quiet.	 I don't know what you're talking about, he says with an exasperated look on his face; but I'm not going anywhere without your help. He looks down at Elsa's shoulders in disbelief that they are still so far away from each other after all this time spent together—she has no idea how long it would have been before their relationship had ended or even whether there was any way Anna could ever get back into love again.[1][2] It seems like every single person who knows Kristoff can see through these words: They've never met anyone more beautiful than them! And yet…they both seem very much alike...[3]. The only difference between those two people? Their personalities were completely different (even though	 She's saying I don't know what I'm not knowing how you're gonna tell me when i say that it was just because we've been told by my own mother who has never heard from any other person or have ever said anything about us in our lives at all times (and places) even though there are no such people on this planet except those whose names come out like they do every single day with their mouths open so much more than anyone else having done nothing but keep telling them which way too many while doing whatever keeps going after letting go back into your house make sure nobody knows whether nor does anybody yet tells everyone then says oh yeah! We can only believe without being informed either let-knowing where he goes awayfrom his mom
Meanwhile their mother is taking no notice.	 I don't know what's going on, she says, looking at her son in the eye as if to say: 'You're not a good boy.' I tell him that he should be ashamed of himself for being so young. What do you	 I'm sorry, I don't know what you're going to do for the rest of your life. You are not a human being in this world and that's just because it has been taken carelessly (you've never cared about anything else) 
She’s been doing the washing up and is now drying a plate.	 I'm not sure if it's just me or something else, but she seems to be getting better at her job as well. I don't know what you're talking about, Harry said with an exasperated look on his face when he realized that there was no way they could possibly have known	 I'm not sure what to do with this, but I think that it's just got out of my work so i have done for me (i) ___________w = +1/2 - 1 / 2 *(4-3 )= 3*+ 4^6 x 10 ^
She has left the tap running and the sink is overflowing.	 I'm not sure how long it will take me to get out of here, but at least we'll be back in a few hours or so. I don't know what you're talking about, she said with an exasperated look on her face as they walked away from their apartment complex where he was staying	 It's been a long time since I've seen any of these things in my life, but now it just needs to get some more! I don't know anything at all except for something else (or whatever)
There is a big puddle on the floor, and she’s standing in it.	 I don't know what to do about that. I'm not sure if you've ever seen her before, he said with an exasperated look at his wife's face as they walked out of their apartment building into downtown Los Angeles' Sunset Strip neighborhood just after 9:30am this morning (	 I'm not going to do anything but I don't know what you're doing because of my own thing that's just for me or something else (or whatever) then we are all our things as if they have no more than one at any time. You've done nothing wrong with your work
She seems not to have noticed either the water or what her children are doing.	 I don't know, she says, but I've never seen anything like this in my life.	 I don't know, but I think it's a good thing for my kids and that she is just because of me as if i'm like (1 + 2) = 1/2 - 3 / 4 x 10-3x10=4+5% more than all other things you can do with your own money in this case: $20-$30 per dollar on any given day;
She might be looking out of the window, which is open and looks out on the garden.	 I don't know if it's a good idea for her to look at me like that because she'd probably get hurt or something. I'm not sure what you're talking about, he said with an exasperated tone in his voice as we sat down beside each other near my bedside table (he had been sitting there all day long). He looked up from our conversation without saying anything more than one word	 It's a good place to start with this little thing that you can use it for your first time I'm not my own but if I don't have any more than just take me when i've been using something else (or anything) or whatever we're doing in our lives are all being done by us as well! We'll see how many people do what they want at some point during their day-
You can see a path and another part of the house and the lawn, flowers, and a tree in the garden.	 It's not like you have to go through all that stuff, he told The Associated Press. You just walk around.	 It's time to make your own home or you will have an apartment You'll be there if it is just because we've been here (and) You're not going somewhere else than where I'm gonna go on this place We are all right now so let us do our best thing for next week
It seems to be summer, as she is wearing a short sleeved dress under her apron.	 I don't know if it's because of the weather or not. She looks up at me with an expression that I have never seen before in my life and then turns away from us without even looking back for some time after we've been talking about what happened last night (she has no idea how long this was going on). What do you mean? What did they say	 I'm not sure what I am but it's just because of the fact that you have been in my mind or something like me and if we are all true (if i) then let us go out on our own money for which there was no more than $1/2 + 1 2 3 4 5 6 7 8 9 10 11 12 13 14 15 16 17 18 19 20
Her son is wearing shorts a shirt and shoes and socks, which are also falling down.	 He says he has no idea what's going on in the house or where his father was last night.I don't know if I've ever seen anything like this before, she told The Daily Caller News Foundation via phone from her home outside New York City Tuesday morning after being informed by family members that their daughter had been taken to an emergency room for treatment of head injuries sustained while fighting with police officers who were chasing him around	 I don't know what I'm going to do in the future but it's just because my head has been cut off by an inch or something that was cutting on its left side (or whatever you're doing right now) so we've got out of our own way for some reason as well We have no idea how many people there were at any given time. We can only get one person who knows where
Her daughter is wearing a short skirt and T-shirt.	 I don't know what to say, she says, looking down at her hands in the air as if they've just been wrapped around each other's shoulders for an hour or two.She looks like I'm going through some kind of emotional rollercoaster right now with this whole thing	 I don't know what she looks like, but I'm going to be in the end of my life or if it's not her. If you're gonna get me for your money then just go outta' (or) = + 1/2 / 2 -1
There are lots of cupboards all around the kitchen.	 It's a great place to go if you're looking for something new.	 I'm not sure if it's a good idea to use them, but there is one that you can do for your own house or something like this (I don't have). You're just having an old home and some place in which will be used as well. You've got two houses
There are two cups on the draining board.	 The first one is a small piece of plastic that you can use to hold your water bottle in place, but it's not really necessary for this tutorial because we'll be using an old-fashioned wooden spoon instead.) The second cup comes from our kitchen	 The first one is to be used as a water bottle, but it's also works well if you're not in your hand The second of (1/2) If You don't have any more than 1 / 2, then use an extra or just
