sentence	control	dementia
There are two children and their mother in the kitchen.	 I'm not sure what to do with them, she said, adding: I don't know if it's a good idea.	 It is not necessary to have a child, but you can't need it's no I'm just like they're too baby or your mom i love my little girl so much she loves her daughter of mine for me daddy mama nanny jimmy dadma paulnaypawwwwww oh god damn
The little boy has climbed up, on a three legged stool to get some cookies from the jar in the cupboard.	 I'm not sure if it's just me or him, he says with an exasperated look at his friend who is standing by and watching as they take their first bite of cookie dough before heading out for lunch later that afternoon. You know what? I don't think we should be doing anything like this right now because there are so many other kids around here! The two boys start talking about how much better life would have been without them but then suddenly realize something else: They	 I think it's like this is so you can't know that i'm not even if they're just say no but yeah oh yes and all right now let me go out there for sure one day of every year or two years ago when will be back then old days are always remember how long time till last few months before first month after second week because we'll never have any more than next couple weeks until maybe ever again forever keep them stay hold their own people who love each other person loves
The stool is about to fall over, so he’s probably going to fall on the floor.	 I don't know if that's a good idea or not. I think you're right, she said with an exasperated look in her eyes and then looked up at him as though it were some kind of joke—she had never seen anything like this before! He turned his head away from me while looking down into my face for what seemed almost imperceptibly long time	 I don't think it's not like you know what if they're there are no i'm just maybe yeah that was kind of oh yes and all right now okay but hey sorry good for sure well ok go get better than let me give them back in a little more then take away from home or something else make up out here put down be safe place where can help with your
His sister is holding up one hand as if she is waiting for him to pass her some of the cookies, and she’s holding a finger to her mouth as if to warn her brother to be quiet.	 I don't know what you're talking about, he says with an exasperated look on his face; but I'm not going anywhere without your help. He looks down at Elsa's shoulders in disbelief that they are still so far away from each other after all this time spent together—she has no idea how long it would have been before their relationship had ended or even whether there was any way Anna could ever get back into love again.[1][2] It seems like every single person who knows Kristoff can see through these words: They've never met anyone more beautiful than them! And yet…they both seem very much alike...[3]. The only difference between those two people? Their personalities were completely different (even though	 you don't let your hands that are just hold on their fingers like they're not even i dont take it's okay but oh yeah no I'm gonna give me my mommy little baby daddy momma mothermom mummama dadma sonna fathermother nanny paulpapa cuz he was so much too many times when his parents were all fathers who have been mothers in this country now moms with kids or dads sonsnap papas boyscunts daughterskaps girls kimpshops hotties tittypants bigtits jesus christmas ganjones dansons babiesgads fucks them sarahfuckers shawkins wahnswahs bunnysbuddy
Meanwhile their mother is taking no notice.	 I don't know what's going on, she says, looking at her son in the eye as if to say: 'You're not a good boy.' I tell him that he should be ashamed of himself for being so young. What do you	 I'm not sure if she's still in the same as i can't see it looks like this, but you know that would be good for her mom and they're just so bad to look at these are all those were a lot of great big thanks thank god bless
She’s been doing the washing up and is now drying a plate.	 I'm not sure if it's just me or something else, but she seems to be getting better at her job as well. I don't know what you're talking about, Harry said with an exasperated look on his face when he realized that there was no way they could possibly have known	 I'm not sure it's fine, but i don't know if you want to wash your hands off my hand on top of bottom right side down back left sides out there are all over here they're just like this one thing that can be good enough for me too much better than ok so many more then
She has left the tap running and the sink is overflowing.	 I'm not sure how long it will take me to get out of here, but at least we'll be back in a few hours or so. I don't know what you're talking about, she said with an exasperated look on her face as they walked away from their apartment complex where he was staying	 I'm not sure, but it's just a good idea that you can't know how much better than what i like to see this picture of my favorite picny pictures for me too nice pics so many great photos all these are some awesome photo no one or maybe even if they have been taken by someone who took them in
There is a big puddle on the floor, and she’s standing in it.	 I don't know what to do about that. I'm not sure if you've ever seen her before, he said with an exasperated look at his wife's face as they walked out of their apartment building into downtown Los Angeles' Sunset Strip neighborhood just after 9:30am this morning (	 I don't know if you want to say that's not like i dont think about do u can tell me when they are just wanna make them all of their own people who have been told by someone said or some one person says something saying I love my mommy mother mama namma bim
She seems not to have noticed either the water or what her children are doing.	 I don't know, she says, but I've never seen anything like this in my life.	 I think she has a lot of it's just like this is so i don't know how do you can tell me about my kids say that they love their parents and want them too many people who care for themselves, but if there was never will be happy in life long ago when we were always loved by everyone loves all those old ones remember fond memories from childhood favorite favorites forever favourite past favourites: 
She might be looking out of the window, which is open and looks out on the garden.	 I don't know if it's a good idea for her to look at me like that because she'd probably get hurt or something. I'm not sure what you're talking about, he said with an exasperated tone in his voice as we sat down beside each other near my bedside table (he had been sitting there all day long). He looked up from our conversation without saying anything more than one word	 I don't want to see it's not like you know what they're just look up there are all right now oh yeah no i think about how do that would make sure way so good for me too well go get better than any one or two big enough but maybe even if we can take a lot more then let them give us some say thanks thank god please tell your friends help with their own money share this
You can see a path and another part of the house and the lawn, flowers, and a tree in the garden.	 It's not like you have to go through all that stuff, he told The Associated Press. You just walk around.	 you know that is your yard or it's not there are no they don't want to get away from home up back down right where on top left side out front off bottom middle ground floor straight line center field point guard forward end zone defensive tackle offensive lineman pass rusher quarterback play defense run offense running backs rush for tight ends punter punt return touchdown kickback rushing through all wide receivers who have been sacked at least one team has had two teams started with three quarterbacks rushed
It seems to be summer, as she is wearing a short sleeved dress under her apron.	 I don't know if it's because of the weather or not. She looks up at me with an expression that I have never seen before in my life and then turns away from us without even looking back for some time after we've been talking about what happened last night (she has no idea how long this was going on). What do you mean? What did they say	 I'm not sure it looks like this but i don't know what if you can tell me about how do say something that's my mommy little things are so much they're all of the same old stuff and some new thing or maybe just one big idea in your own ideas for people who have been told by their friends on facebook share them out here let us get together with each other kind
Her son is wearing shorts a shirt and shoes and socks, which are also falling down.	 He says he has no idea what's going on in the house or where his father was last night.I don't know if I've ever seen anything like this before, she told The Daily Caller News Foundation via phone from her home outside New York City Tuesday morning after being informed by family members that their daughter had been taken to an emergency room for treatment of head injuries sustained while fighting with police officers who were chasing him around	 I'm not going to the same as i don't go it's just like you're gonna be ok but if they were okay yeah that was good for sure ya know u can get on top of pants or t-shirt white shirts black panty browns all right now y'all up in front back side off bottom left sides out there big red stripes yellow striped colors pink stripe blue color purple tee green colored teal
Her daughter is wearing a short skirt and T-shirt.	 I don't know what to say, she says, looking down at her hands in the air as if they've just been wrapped around each other's shoulders for an hour or two.She looks like I'm going through some kind of emotional rollercoaster right now with this whole thing	 She's not sure that she doesn't know if you can tell me about her mom I'm sorry to be my mother i dont think it was just like this one of the way so much too long time when they are all right now oh no wait till we're gonna get back up here
There are lots of cupboards all around the kitchen.	 It's a great place to go if you're looking for something new.	 I'm not sure if you want to get it's just a good idea but i don't think about that would be like this is cool and they're gonna make me know how much better than what do u can give your money or buy something for free will tell people who wanna help with their own
There are two cups on the draining board.	 The first one is a small piece of plastic that you can use to hold your water bottle in place, but it's not really necessary for this tutorial because we'll be using an old-fashioned wooden spoon instead.) The second cup comes from our kitchen	 This is not necessary, but you can't need to be there's a cup of water bottle or something like I'm just maybe they're so it was good enough no i think about that would make me know how much better than what if u want more then
