sentence	control	dementia
There are two children and their mother in the kitchen.	 I'm not sure what to do with them, she said, adding: I don't know if it's a good idea.	 I'm not sure if this is true, but i don't know how much more than 1 year ago when you're no doubt then yes it's one child with your mommy or her mumma has a baby who she was never say so many years later on day they were said to be very long months days of
The little boy has climbed up, on a three legged stool to get some cookies from the jar in the cupboard.	 I'm not sure if it's just me or him, he says with an exasperated look at his friend who is standing by and watching as they take their first bite of cookie dough before heading out for lunch later that afternoon. You know what? I don't think we should be doing anything like this right now because there are so many other kids around here! The two boys start talking about how much better life would have been without them but then suddenly realize something else: They	 He's been climbing down stairs and getting his cookie dough out of it. I'm not gonna let him do something that I don't know what he did doing things like this one thing is done by me 
The stool is about to fall over, so he’s probably going to fall on the floor.	 I don't know if that's a good idea or not. I think you're right, she said with an exasperated look in her eyes and then looked up at him as though it were some kind of joke—she had never seen anything like this before! He turned his head away from me while looking down into my face for what seemed almost imperceptibly long time	 I don't know how much more than when you're sitting down in your chair and it's just falling up there are gonna be coming out of his seat at her desk or she was standing right here i'm not knowing what exactly as if they were saying ohhhhhhh yeah yes no say something that says like this does mean go ahead means do have come forward but now comes back
His sister is holding up one hand as if she is waiting for him to pass her some of the cookies, and she’s holding a finger to her mouth as if to warn her brother to be quiet.	 I don't know what you're talking about, he says with an exasperated look on his face; but I'm not going anywhere without your help. He looks down at Elsa's shoulders in disbelief that they are still so far away from each other after all this time spent together—she has no idea how long it would have been before their relationship had ended or even whether there was any way Anna could ever get back into love again.[1][2] It seems like every single person who knows Kristoff can see through these words: They've never met anyone more beautiful than them! And yet…they both seem very much alike...[3]. The only difference between those two people? Their personalities were completely different (even though	 She looks like he has hes standing on his bed with two hands in waitresses are sitting at their beds while they sit watching tv shows playing video games talking about movies or reading books going back into movie theater looking down through bookstores staring out from behind glass windows seeing how much more than what you can see that window lookin' overbooking shopping around buying new things by doing it's own thing shop selling old stuff buynewthingsbydoingitselfshopsellingoldstuffbuyingthinggoingbackwardslookingoutfrombehindtheglassshoppingaroundbuymakingnow
Meanwhile their mother is taking no notice.	 I don't know what's going on, she says, looking at her son in the eye as if to say: 'You're not a good boy.' I tell him that he should be ashamed of himself for being so young. What do you	 I don't know what you're talking about, but I'm not aware of it's just knowing your mum and her father being informed that she isn´ telling the truth to them they are informing me.
She’s been doing the washing up and is now drying a plate.	 I'm not sure if it's just me or something else, but she seems to be getting better at her job as well. I don't know what you're talking about, Harry said with an exasperated look on his face when he realized that there was no way they could possibly have known	 I'm not gonna do it, but you're getting done to dry plates are being washed down by me ‪is be making wet dishes washing off of mittens with an ice cream dispenser that he's got going on snowflakes in his showering baththeshe was putting water into
She has left the tap running and the sink is overflowing.	 I'm not sure how long it will take me to get out of here, but at least we'll be back in a few hours or so. I don't know what you're talking about, she said with an exasperated look on her face as they walked away from their apartment complex where he was staying	 I don't know how long it's going to be filled with water, but I'm not sure enough that its gone out overflowed so much too many more than most of this year i am unsure if my life was changed in a few months agoi have leave now drained well no longer emptying wells are empty
There is a big puddle on the floor, and she’s standing in it.	 I don't know what to do about that. I'm not sure if you've ever seen her before, he said with an exasperated look at his wife's face as they walked out of their apartment building into downtown Los Angeles' Sunset Strip neighborhood just after 9:30am this morning (	 I'm not going to my house. I don't know what you're doing right now. She's holding her pearls at all times when they are sitting down with their pellucid cup of water that has been held up by them She looks like an apple tree stands for raindrops
She seems not to have noticed either the water or what her children are doing.	 I don't know, she says, but I've never seen anything like this in my life.	 She doesn't even notice that she is NOT noticing any of hers kids being done, and why neither does seem like they donot see no matter how many things happen in their lives as if i know nothing about them but I can tell you something happensin my life so much more than your parents say anything says everything tells me it's a good day for everyone has been told by everybody knows this stuffs all
She might be looking out of the window, which is open and looks out on the garden.	 I don't know if it's a good idea for her to look at me like that because she'd probably get hurt or something. I'm not sure what you're talking about, he said with an exasperated tone in his voice as we sat down beside each other near my bedside table (he had been sitting there all day long). He looked up from our conversation without saying anything more than one word	 I know that she knows it's not look in her windows are opening up or closing down. I don't want to see if i'm seeing a picture like an empty glass door closed but opens with doors shut off. You'relookingoutofthewindowisopeningupandlookinginwindowsclosedoffdooropenbutopenswithdoorspansedoncomingtoheavensopenedaswell
You can see a path and another part of the house and the lawn, flowers, and a tree in the garden.	 It's not like you have to go through all that stuff, he told The Associated Press. You just walk around.	 And if you want to look at an area where there are plants or trees that grow on your own property? You know how it feels like they're looking for something else go away from what is not going home with someone who have been living out their life without having lived up being alive walking around talking about sitting down playing music watching movies reading books shopping online buying new cars driving through parking lots taking pictures getting into restaurants eating food making sure everyone has enough money so we
It seems to be summer, as she is wearing a short sleeved dress under her apron.	 I don't know if it's because of the weather or not. She looks up at me with an expression that I have never seen before in my life and then turns away from us without even looking back for some time after we've been talking about what happened last night (she has no idea how long this was going on). What do you mean? What did they say	 I'm sure it's cold weather but not wintering in my coat and pants underneath mea wears an autumn shirt over his jacket with long sleeves on top of the hat that he has worn snow-covered coats beneath him I've been told by someone else who said they are saying they're telling us
Her son is wearing shorts a shirt and shoes and socks, which are also falling down.	 He says he has no idea what's going on in the house or where his father was last night.I don't know if I've ever seen anything like this before, she told The Daily Caller News Foundation via phone from her home outside New York City Tuesday morning after being informed by family members that their daughter had been taken to an emergency room for treatment of head injuries sustained while fighting with police officers who were chasing him around	 He looks like he can't fall asleep on the floor of his father's house where pants have been flowing in rainpants jeans trousers with shirts that they fell to their parents' feet after falls Rainy boy who has fallen from her dad´s bedroom when she was lying beside him saying: I'm sorry for what I did not say: He looked up at night time.
Her daughter is wearing a short skirt and T-shirt.	 I don't know what to say, she says, looking down at her hands in the air as if they've just been wrapped around each other's shoulders for an hour or two.She looks like I'm going through some kind of emotional rollercoaster right now with this whole thing	 She looks like she's going to the bathroom with her long hair, but I don't know how many of these things are worn by girls in their school dress gowns that they wear as well I'm not sure about this stuff
There are lots of cupboards all around the kitchen.	 It's a great place to go if you're looking for something new.	 It's a great place to hang out with your kids, and you can't have cupsboard everywhere in this house. I'm sure that it is an area where everyone else people who come here for drinks at places they drink alcohols on their own home or wherever everybody comes over drinking water from somewhere
There are two cups on the draining board.	 The first one is a small piece of plastic that you can use to hold your water bottle in place, but it's not really necessary for this tutorial because we'll be using an old-fashioned wooden spoon instead.) The second cup comes from our kitchen	 One of them is a cup, but I don't you're not no one can be me oh yeah yes? I'm going to drink some water with my finger and it's just like i am drinking so much too many more than all over well
