sentence	control	dementia
There are two children and their mother in the kitchen.	 I'm not sure what to do with them, she said, adding: I don't know if it's a good idea.	 It is that they have been a few people, but not only when you can be sure as well into this year-in' (or to make it's I am I've had no longer than any time for all over at an's of some years ago: The following his or just before he has become
The little boy has climbed up, on a three legged stool to get some cookies from the jar in the cupboard.	 I'm not sure if it's just me or him, he says with an exasperated look at his friend who is standing by and watching as they take their first bite of cookie dough before heading out for lunch later that afternoon. You know what? I don't think we should be doing anything like this right now because there are so many other kids around here! The two boys start talking about how much better life would have been without them but then suddenly realize something else: They	 It is not only if you can be sure as well into this year-in' and it was that they have no longer than any time for all over there are two years ago (and I've been made by way back when asked meek's of hiss were he said The following an 'ttee:
The stool is about to fall over, so he’s probably going to fall on the floor.	 I don't know if that's a good idea or not. I think you're right, she said with an exasperated look in her eyes and then looked up at him as though it were some kind of joke—she had never seen anything like this before! He turned his head away from me while looking down into my face for what seemed almost imperceptibly long time	 I have been a few people are not only if you can be sure as well into this year- it's in' (as of all day and that they had no longer than any time with their way back in which would make for those who knows how much more or just like an 'em: The following his name change from one after being used by far too! 
His sister is holding up one hand as if she is waiting for him to pass her some of the cookies, and she’s holding a finger to her mouth as if to warn her brother to be quiet.	 I don't know what you're talking about, he says with an exasperated look on his face; but I'm not going anywhere without your help. He looks down at Elsa's shoulders in disbelief that they are still so far away from each other after all this time spent together—she has no idea how long it would have been before their relationship had ended or even whether there was any way Anna could ever get back into love again.[1][2] It seems like every single person who knows Kristoff can see through these words: They've never met anyone more beautiful than them! And yet…they both seem very much alike...[3]. The only difference between those two people? Their personalities were completely different (even though	 I have been in this year-in' (and are not only when you can't even though it was that they had no longer than any time with their way back then? It's I ami…
Meanwhile their mother is taking no notice.	 I don't know what's going on, she says, looking at her son in the eye as if to say: 'You're not a good boy.' I tell him that he should be ashamed of himself for being so young. What do you	 It's, and the other than it was a few people are not only when you can be sure as well into this year- I have been made by way back in an in' (as of all day to make up until they were he said that's
She’s been doing the washing up and is now drying a plate.	 I'm not sure if it's just me or something else, but she seems to be getting better at her job as well. I don't know what you're talking about, Harry said with an exasperated look on his face when he realized that there was no way they could possibly have known	 It's, but not only when you can be sure as well into this year- I have to make it was that they are two years back in their way more than any time for some of all over at one day or just like no matter (or with an in' s/ttee 
She has left the tap running and the sink is overflowing.	 I'm not sure how long it will take me to get out of here, but at least we'll be back in a few hours or so. I don't know what you're talking about, she said with an exasperated look on her face as they walked away from their apartment complex where he was staying	 It's, but not only when it was a little more than any time for this year- I have been made by way back in hiss are two years before he said to be sure as well into that they had no longer termites of their in' (or with an 'ttee: http://www
There is a big puddle on the floor, and she’s standing in it.	 I don't know what to do about that. I'm not sure if you've ever seen her before, he said with an exasperated look at his wife's face as they walked out of their apartment building into downtown Los Angeles' Sunset Strip neighborhood just after 9:30am this morning (	 It's I have not only when you can be sure looks like this year- I don't even if they are two years ago to make up until now that has been made by way more than any time for all over at some of course with no matter as well beyond what we see here: 
She seems not to have noticed either the water or what her children are doing.	 I don't know, she says, but I've never seen anything like this in my life.	 It's, and it is that she has been in a few people who can be sure as well into this year- I think about how much like no longer than any time of all day by way back when they do you don't even more often enough for some years ago (in', but with hiss were he said I ami 'ttee: http://www. The factored
She might be looking out of the window, which is open and looks out on the garden.	 I don't know if it's a good idea for her to look at me like that because she'd probably get hurt or something. I'm not sure what you're talking about, he said with an exasperated tone in his voice as we sat down beside each other near my bedside table (he had been sitting there all day long). He looked up from our conversation without saying anything more than one word	 It was a few people are not only when they have been made by way back in this year-in' (or to make up until it's that I've had no longer than any time for all over there were you can't just as well beyond what we would seem like so far more or 'em: The most likely will probably because he has never seen here at some years ago with hiss from
You can see a path and another part of the house and the lawn, flowers, and a tree in the garden.	 It's not like you have to go through all that stuff, he told The Associated Press. You just walk around.	 It is not only when they have been made by way back to make it's in' (theory for this year-wise with no longer than any time will be sure as well beyond what we are two years ago that I think about how much like so long before he has become more or at all over there was an 'em: The following hiss were you don't even if one day after every few people who knows best practices on their own up
It seems to be summer, as she is wearing a short sleeved dress under her apron.	 I don't know if it's because of the weather or not. She looks up at me with an expression that I have never seen before in my life and then turns away from us without even looking back for some time after we've been talking about what happened last night (she has no idea how long this was going on). What do you mean? What did they say	 I have been in the other than any time and it would not only if you can make for this year-in' (and are some of all over there were they had no matter more or's with their own that was an The first classifies what we will probably won't even though he has made by way back then? It's from which makes meldttee 
Her son is wearing shorts a shirt and shoes and socks, which are also falling down.	 He says he has no idea what's going on in the house or where his father was last night.I don't know if I've ever seen anything like this before, she told The Daily Caller News Foundation via phone from her home outside New York City Tuesday morning after being informed by family members that their daughter had been taken to an emergency room for treatment of head injuries sustained while fighting with police officers who were chasing him around	 It's in the other than any time to make it would not only if you can be sure looks like this year-like that they have been made by way back when I think about how many years ago (see: in'
Her daughter is wearing a short skirt and T-shirt.	 I don't know what to say, she says, looking down at her hands in the air as if they've just been wrapped around each other's shoulders for an hour or two.She looks like I'm going through some kind of emotional rollercoaster right now with this whole thing	 The following the next to make it's, but not only when you can be sure looks like this year after they are two years ago (and I have no longer than ever so that has been made by way back in their in' s/ttee of all over time for
There are lots of cupboards all around the kitchen.	 It's a great place to go if you're looking for something new.	 It's, and it is that they have been in a few people can be sure as well into this year-in' (and I was not only if you would make up to helpfully with no longer than any time for those who knows how much more or's were he has long before
There are two cups on the draining board.	 The first one is a small piece of plastic that you can use to hold your water bottle in place, but it's not really necessary for this tutorial because we'll be using an old-fashioned wooden spoon instead.) The second cup comes from our kitchen	 It is a few people, and it was not only when you can be sure looks like this year-in' (and I have no longer than ever so that they had to make for some of any time with their I ami's in an '
