sentence	control	dementia
There are two children and their mother in the kitchen.	 I'm not sure what to do with them, she said, adding: I don't know if it's a good idea.	 The first is a young man, who has no idea of what he's going to do with his own child: I don't know how much I can be done for my little boy. The second one was an old-schooler (and not so far from me) that it would have been more than
The little boy has climbed up, on a three legged stool to get some cookies from the jar in the cupboard.	 I'm not sure if it's just me or him, he says with an exasperated look at his friend who is standing by and watching as they take their first bite of cookie dough before heading out for lunch later that afternoon. You know what? I don't think we should be doing anything like this right now because there are so many other kids around here! The two boys start talking about how much better life would have been without them but then suddenly realize something else: They	 It's not so bad that I can't have any more of them at all! I think it would be better if they had no one or two (and then you could see how many people are getting their food and what is being eaten by an old man who was just as he sat there with his head down for about half-a few minutes before we got back into our own room...
The stool is about to fall over, so he’s probably going to fall on the floor.	 I don't know if that's a good idea or not. I think you're right, she said with an exasperated look in her eyes and then looked up at him as though it were some kind of joke—she had never seen anything like this before! He turned his head away from me while looking down into my face for what seemed almost imperceptibly long time	 I think that's a good way of getting back up and down but I don't know if you can do it in this case or not at all (if there are any other people who would have been here for more than two years as they could be with their own life after having had some time off-time things done by them when we were coming home from one day
His sister is holding up one hand as if she is waiting for him to pass her some of the cookies, and she’s holding a finger to her mouth as if to warn her brother to be quiet.	 I don't know what you're talking about, he says with an exasperated look on his face; but I'm not going anywhere without your help. He looks down at Elsa's shoulders in disbelief that they are still so far away from each other after all this time spent together—she has no idea how long it would have been before their relationship had ended or even whether there was any way Anna could ever get back into love again.[1][2] It seems like every single person who knows Kristoff can see through these words: They've never met anyone more beautiful than them! And yet…they both seem very much alike...[3]. The only difference between those two people? Their personalities were completely different (even though	 The other two are standing with their hands on his back while they were still not looking at them in any way or when he was so far away from all that it could have been seen by anyone who would know how many things had come about this time; but what I can tell you there's no more than three days since we've only got an hour before going into town (I'm sure will do get out now)
Meanwhile their mother is taking no notice.	 I don't know what's going on, she says, looking at her son in the eye as if to say: 'You're not a good boy.' I tell him that he should be ashamed of himself for being so young. What do you	 The only one of the three main characters in-game events that will take place, and it's not a good thing to do but I think about how much time has been spent on this game so many other things as you can't be too far away from
She’s been doing the washing up and is now drying a plate.	 I'm not sure if it's just me or something else, but she seems to be getting better at her job as well. I don't know what you're talking about, Harry said with an exasperated look on his face when he realized that there was no way they could possibly have known	 I'm not sure if it's going to be done, but there are some other things that we can do in this case as well so you know how many people have gone out of their own accord with what they've got for them at present time (I don't think about any more than one or two
She has left the tap running and the sink is overflowing.	 I'm not sure how long it will take me to get out of here, but at least we'll be back in a few hours or so. I don't know what you're talking about, she said with an exasperated look on her face as they walked away from their apartment complex where he was staying	 I have a few more to do, but I think it's not that much of an issue at this point in time as you can't be sure there are some other people who will come out with their own hands on your back (or if they're going for them)
There is a big puddle on the floor, and she’s standing in it.	 I don't know what to do about that. I'm not sure if you've ever seen her before, he said with an exasperated look at his wife's face as they walked out of their apartment building into downtown Los Angeles' Sunset Strip neighborhood just after 9:30am this morning (	 I think about what to do with this one of these two people who have been there for so long that they can't even get any more than 2 or 3 minutes from their own time (or at least 1-2 hours). I'm not really sure if you are doing anything but i'd be
She seems not to have noticed either the water or what her children are doing.	 I don't know, she says, but I've never seen anything like this in my life.	 I don't know, but it's been a long time and I've had no idea of where she was going with this in my mind that they would be so much more than we can do for them at any other place (or if there is such an actual one-way on their way out from here as well...
She might be looking out of the window, which is open and looks out on the garden.	 I don't know if it's a good idea for her to look at me like that because she'd probably get hurt or something. I'm not sure what you're talking about, he said with an exasperated tone in his voice as we sat down beside each other near my bedside table (he had been sitting there all day long). He looked up from our conversation without saying anything more than one word	 I have no idea what to do with this but I think it's a little more than one or two (or three if you're not sure that there are some people who can't see all these things in their own eyes as they look at each other side so far?
You can see a path and another part of the house and the lawn, flowers, and a tree in the garden.	 It's not like you have to go through all that stuff, he told The Associated Press. You just walk around.	 The next step is to make sure that there are no more than two or three-four (or four if it's not at least as many people will be very careful about what they have done with their own home; but I do know how much time has been spent on them for so long before we get back into some other place where you may find out any one thing which would give us an advantage over those who had taken caretly away from
It seems to be summer, as she is wearing a short sleeved dress under her apron.	 I don't know if it's because of the weather or not. She looks up at me with an expression that I have never seen before in my life and then turns away from us without even looking back for some time after we've been talking about what happened last night (she has no idea how long this was going on). What do you mean? What did they say	 It's been in the hospital for about an hour and I've had no idea of what it was going on at all this time (I don't know how many people have come back from that place but they are not so much more or less than when you go out there with your friends who can get them off their own feet if we're too far enough away The only one person has
Her son is wearing shorts a shirt and shoes and socks, which are also falling down.	 He says he has no idea what's going on in the house or where his father was last night.I don't know if I've ever seen anything like this before, she told The Daily Caller News Foundation via phone from her home outside New York City Tuesday morning after being informed by family members that their daughter had been taken to an emergency room for treatment of head injuries sustained while fighting with police officers who were chasing him around	 I'm not sure what's going to be on the other side of it but I can't think about that at this point in time if you're looking for something like an old-school or new school (or maybe even older) person who has been around long enough so they'll probably have some more recent experience with their parents as well...
Her daughter is wearing a short skirt and T-shirt.	 I don't know what to say, she says, looking down at her hands in the air as if they've just been wrapped around each other's shoulders for an hour or two.She looks like I'm going through some kind of emotional rollercoaster right now with this whole thing	 I don't know what I'm going to do with this, but it's the only thing that makes me feel so much more comfortable in my own skin.
There are lots of cupboards all around the kitchen.	 It's a great place to go if you're looking for something new.	 It's a good place to start with, but I don't know if you're going for it or not at this point in your life as an old-schooler (or new school) person who is just getting started on that one and will be sure about what they've been doing so far
There are two cups on the draining board.	 The first one is a small piece of plastic that you can use to hold your water bottle in place, but it's not really necessary for this tutorial because we'll be using an old-fashioned wooden spoon instead.) The second cup comes from our kitchen	 The second cup is a very good one, but I think it's not going to be an all-in and you can't have any of them in this game (I'm sure they'll get some more than 1 or 2 as well so that
