sentence	control	dementia
There are two children and their mother in the kitchen.	 I'm not sure what to do with them, she said, adding: I don't know if it's a good idea.	 The first is a little girl, but she's not very good at it, said one of her friends who was there to see what they were doing on that day. I don't know if I should have been more careful with my actions or just let them get away from me like this because you're
The little boy has climbed up, on a three legged stool to get some cookies from the jar in the cupboard.	 I'm not sure if it's just me or him, he says with an exasperated look at his friend who is standing by and watching as they take their first bite of cookie dough before heading out for lunch later that afternoon. You know what? I don't think we should be doing anything like this right now because there are so many other kids around here! The two boys start talking about how much better life would have been without them but then suddenly realize something else: They	 He's not very good at it and he doesn't have any of those things that I can tell you about. I've never seen him do anything like this before, said one person who had been there for more than 20 minutes but was still standing with his head down when they saw an old-looking man walking around their feet as if someone could be saying: The guy is pretty much too tall (or just plain wrong). You know what? You'd better go back
The stool is about to fall over, so he’s probably going to fall on the floor.	 I don't know if that's a good idea or not. I think you're right, she said with an exasperated look in her eyes and then looked up at him as though it were some kind of joke—she had never seen anything like this before! He turned his head away from me while looking down into my face for what seemed almost imperceptibly long time	 I don't know if that's a good idea or not. I think it would be better for you and your family in some way, she said with an expression of her displeasure at being called out by someone who was just standing there while they were watching TV shows like this: http://i1817-a2b3/d8e9f4c5
His sister is holding up one hand as if she is waiting for him to pass her some of the cookies, and she’s holding a finger to her mouth as if to warn her brother to be quiet.	 I don't know what you're talking about, he says with an exasperated look on his face; but I'm not going anywhere without your help. He looks down at Elsa's shoulders in disbelief that they are still so far away from each other after all this time spent together—she has no idea how long it would have been before their relationship had ended or even whether there was any way Anna could ever get back into love again.[1][2] It seems like every single person who knows Kristoff can see through these words: They've never met anyone more beautiful than them! And yet…they both seem very much alike...[3]. The only difference between those two people? Their personalities were completely different (even though	 I don't know what you're talking about, he said in an angry tone that made me feel like I was being held back from my own side. You are just saying it's not your fault because there were two people who had no such rights at all but they could have any other right or wrong on this account: You can only do so many things without knowing how much time has passed since we last saw eachother (the same thing happened with our first meeting). We've also been having more fun than ever!
Meanwhile their mother is taking no notice.	 I don't know what's going on, she says, looking at her son in the eye as if to say: 'You're not a good boy.' I tell him that he should be ashamed of himself for being so young. What do you	 I don't know what's going on, but I can tell you right now that the police are doing a great job, she said in an interview with The New York Times last week and was quoted as saying it would be good for her to get out of jail
She’s been doing the washing up and is now drying a plate.	 I'm not sure if it's just me or something else, but she seems to be getting better at her job as well. I don't know what you're talking about, Harry said with an exasperated look on his face when he realized that there was no way they could possibly have known	 I don't know what to do with this, but it's not that bad at all for me. I think you should just get out of my way, he said in an e-mail from his wife who was on her honeymoon when she went back home last week (the same day as we
She has left the tap running and the sink is overflowing.	 I'm not sure how long it will take me to get out of here, but at least we'll be back in a few hours or so. I don't know what you're talking about, she said with an exasperated look on her face as they walked away from their apartment complex where he was staying	 I'm not sure what to do with this, but it's a good thing that she doesn't have any more money in her bank account (or at all). I've been told by some of my friends about how much you can get for your own personal use as an in-house or something like
There is a big puddle on the floor, and she’s standing in it.	 I don't know what to do about that. I'm not sure if you've ever seen her before, he said with an exasperated look at his wife's face as they walked out of their apartment building into downtown Los Angeles' Sunset Strip neighborhood just after 9:30am this morning (	 I don't know what to do about that. I'm not sure if you're right or wrong, he says with an exasperated tone of his voice as though there were two people who had just come out from their first day at school—and they are both looking for each other person's name!
She seems not to have noticed either the water or what her children are doing.	 I don't know, she says, but I've never seen anything like this in my life.	 I don't know if it's a good thing for them, but I think they should be more careful with their food, she told The New York Times in an interview that was published on Wednesday and has since been removed from its Facebook page (see video below).
She might be looking out of the window, which is open and looks out on the garden.	 I don't know if it's a good idea for her to look at me like that because she'd probably get hurt or something. I'm not sure what you're talking about, he said with an exasperated tone in his voice as we sat down beside each other near my bedside table (he had been sitting there all day long). He looked up from our conversation without saying anything more than one word	 I don't know if that's a good idea or not but it makes me want to do something with my life. I think you should have been more careful about your work, she said in an e-mail from her husband who was working at his house for two years before he died (see below). You're so much better than any other person! You are just as well! -
You can see a path and another part of the house and the lawn, flowers, and a tree in the garden.	 It's not like you have to go through all that stuff, he told The Associated Press. You just walk around.	 I don't know if that's what you're going to do with it or not. I have no idea where this is coming from, he told The New York Times last year. He also said his wife had been living there for more than two years before she was killed by an unknown man who shot her husband three times at one point during their first time after they were about 2-3 months ago (1/2) The only thing
It seems to be summer, as she is wearing a short sleeved dress under her apron.	 I don't know if it's because of the weather or not. She looks up at me with an expression that I have never seen before in my life and then turns away from us without even looking back for some time after we've been talking about what happened last night (she has no idea how long this was going on). What do you mean? What did they say	 I don't know what's going on in the world but I can see it all around my body. What do you mean by that? You're so hot right now and your legs are too big for me!
Her son is wearing shorts a shirt and shoes and socks, which are also falling down.	 He says he has no idea what's going on in the house or where his father was last night.I don't know if I've ever seen anything like this before, she told The Daily Caller News Foundation via phone from her home outside New York City Tuesday morning after being informed by family members that their daughter had been taken to an emergency room for treatment of head injuries sustained while fighting with police officers who were chasing him around	 I don't know if he's going to be in the hospital or not, said one of his friends who has been with him for more than two years. (Photo: The Enquirer/Shutterstock)
Her daughter is wearing a short skirt and T-shirt.	 I don't know what to say, she says, looking down at her hands in the air as if they've just been wrapped around each other's shoulders for an hour or two.She looks like I'm going through some kind of emotional rollercoaster right now with this whole thing	 I don't know what to say, but I'm not sure if it's the right thing for her, she said in an interview with The New York Times on Monday night (Jan 18) at 2:30 p.
There are lots of cupboards all around the kitchen.	 It's a great place to go if you're looking for something new.	 It's a great place to go if you're looking for something that will make your life easier and more fun.
There are two cups on the draining board.	 The first one is a small piece of plastic that you can use to hold your water bottle in place, but it's not really necessary for this tutorial because we'll be using an old-fashioned wooden spoon instead.) The second cup comes from our kitchen	 The first is a cup of water, which you can use to make your own ice cream and then put it in an air-conditioned container that will last for about 10 minutes or until there's no more than 1/2 inch (or less). 
