sentence	control	dementia
There are two children and their mother in the kitchen.	 I'm not sure what to do with them, she said, adding: I don't know if it's a good idea.	 It is a great deal, but not so much as to what we have been working with our own family members of which I was an uniformed (I don't know if it's any more than just one or no-one at all! The only thing that you can be sure about this
The little boy has climbed up, on a three legged stool to get some cookies from the jar in the cupboard.	 I'm not sure if it's just me or him, he says with an exasperated look at his friend who is standing by and watching as they take their first bite of cookie dough before heading out for lunch later that afternoon. You know what? I don't think we should be doing anything like this right now because there are so many other kids around here! The two boys start talking about how much better life would have been without them but then suddenly realize something else: They	 It's not so much as it is what I can be said that there are no more than one of its two-piece and they have been used for many different reasons: I don't know if you've ever had any real estate (or at all other things. The last time was when we were he who knows how long ago people would say something like this? The most recent news stories about $100 million or less money; but never minding with his/noted by
The stool is about to fall over, so he’s probably going to fall on the floor.	 I don't know if that's a good idea or not. I think you're right, she said with an exasperated look in her eyes and then looked up at him as though it were some kind of joke—she had never seen anything like this before! He turned his head away from me while looking down into my face for what seemed almost imperceptibly long time	 A: I'm not a good one-on and I don't have any of them in my house (or if it's no more than they are all right now. The only thing you can be sure that this was just as much better or at least an extra $1 million for their own personal use—and/from where we were two very different things;
His sister is holding up one hand as if she is waiting for him to pass her some of the cookies, and she’s holding a finger to her mouth as if to warn her brother to be quiet.	 I don't know what you're talking about, he says with an exasperated look on his face; but I'm not going anywhere without your help. He looks down at Elsa's shoulders in disbelief that they are still so far away from each other after all this time spent together—she has no idea how long it would have been before their relationship had ended or even whether there was any way Anna could ever get back into love again.[1][2] It seems like every single person who knows Kristoff can see through these words: They've never met anyone more beautiful than them! And yet…they both seem very much alike...[3]. The only difference between those two people? Their personalities were completely different (even though	 I don't know what I do you think about it, he said in an interview with The New York Times on this week's that they are not just a little bit too much better than we all-time.
Meanwhile their mother is taking no notice.	 I don't know what's going on, she says, looking at her son in the eye as if to say: 'You're not a good boy.' I tell him that he should be ashamed of himself for being so young. What do you	 It's not only one of the two, and a few other things that have been in-game to make it all three or more people who would be at home (and they are very much better than I think about what we've seen on TV shows like The
She’s been doing the washing up and is now drying a plate.	 I'm not sure if it's just me or something else, but she seems to be getting better at her job as well. I don't know what you're talking about, Harry said with an exasperated look on his face when he realized that there was no way they could possibly have known	 The first-time, it's not so much of what I can be said that they are still in their own way to make an even more or atypical (and if you think about how many people who have no idea for the most important things we've ever seen on TV shows like this
She has left the tap running and the sink is overflowing.	 I'm not sure how long it will take me to get out of here, but at least we'll be back in a few hours or so. I don't know what you're talking about, she said with an exasperated look on her face as they walked away from their apartment complex where he was staying	 It's not only one of its two-way, but it was a great deal for me to be sure that I have no idea about what we've been working on my own money: I don't know how many people are you if they're all right. (or at this point in your life as well!
There is a big puddle on the floor, and she’s standing in it.	 I don't know what to do about that. I'm not sure if you've ever seen her before, he said with an exasperated look at his wife's face as they walked out of their apartment building into downtown Los Angeles' Sunset Strip neighborhood just after 9:30am this morning (	 A: I don't know what I can be said that they are not only one of these two-hits to make an even more or less than 1/2 (the same way we have no idea about how much money for our children's needs as well…
She seems not to have noticed either the water or what her children are doing.	 I don't know, she says, but I've never seen anything like this in my life.	 It's a lot of things, and it is that she was very much more than just about any other people who can't do anything at all: I'm in love (and) I've been there for quite some time! The only one-offers will be done with their own personal life as well...
She might be looking out of the window, which is open and looks out on the garden.	 I don't know if it's a good idea for her to look at me like that because she'd probably get hurt or something. I'm not sure what you're talking about, he said with an exasperated tone in his voice as we sat down beside each other near my bedside table (he had been sitting there all day long). He looked up from our conversation without saying anything more than one word	 The first time I was a very good start to this year's in-house (and) I don't know what you are we have been doing for many years; it has not only one or two more than just about every other things that they've done their own business as well!
You can see a path and another part of the house and the lawn, flowers, and a tree in the garden.	 It's not like you have to go through all that stuff, he told The Associated Press. You just walk around.	 I have no idea what to do with my wife's name is that they are not only one or two-hundred: I don't know how many people think it would be if you're all right, he said at this time.
It seems to be summer, as she is wearing a short sleeved dress under her apron.	 I don't know if it's because of the weather or not. She looks up at me with an expression that I have never seen before in my life and then turns away from us without even looking back for some time after we've been talking about what happened last night (she has no idea how long this was going on). What do you mean? What did they say	 I have been in the same place for some time and it's not so much more than just about any other things that are all of their own good old-fashioned I'ma (or at least they don't know what you're we've done! The most recent news: The New York Times has an article on its cover photojournalist/photography by one another
Her son is wearing shorts a shirt and shoes and socks, which are also falling down.	 He says he has no idea what's going on in the house or where his father was last night.I don't know if I've ever seen anything like this before, she told The Daily Caller News Foundation via phone from her home outside New York City Tuesday morning after being informed by family members that their daughter had been taken to an emergency room for treatment of head injuries sustained while fighting with police officers who were chasing him around	 The first-offers of the world's most recent games that have not only one or two (or more than just about any other people who would be able to see if they were in their own home for some reason: I don't know what I've been doing with my kids, he told The New York Times last week when it comes out on its release date as well!
Her daughter is wearing a short skirt and T-shirt.	 I don't know what to say, she says, looking down at her hands in the air as if they've just been wrapped around each other's shoulders for an hour or two.She looks like I'm going through some kind of emotional rollercoaster right now with this whole thing	 I have no idea what to do with the fact that it's not only one of these things, but I don't know if they're all in their own right hand (or at least we can be seen as an informal, which means you've been told by
There are lots of cupboards all around the kitchen.	 It's a great place to go if you're looking for something new.	 It is a great place to me, and it's not so much more than I can be used as an I don't have any other things that would make you feel good at this point in your life! The only thing about which we've been working on my own money: The
There are two cups on the draining board.	 The first one is a small piece of plastic that you can use to hold your water bottle in place, but it's not really necessary for this tutorial because we'll be using an old-fashioned wooden spoon instead.) The second cup comes from our kitchen	 It is a good one-sided, but not so much as to say that they have been used for some of their most recent work and more than just about any other things: I don't know what I can be said in this case, he was
