sentence	control	dementia
There are two children and their mother in the kitchen.	 They have no idea what's going on, but they do know that something terrible is about to happen.	 They have no idea what's going on, but they do know that something terrible is about to happen.
The little boy has climbed up, on a three legged stool to get some cookies from the jar in the cupboard.	 I'm so glad you're here, he says as we sit down at his kitchen table and watch him play with one of our favorite toys: an old-timey toy that looks like it was made by someone who had never seen anything before (he doesn't even know what they are). He's been playing for about five years now—and I've always wondered if this is just another kid doing something new or different every day? It might not be entirely clear how many kids have	 I'm so glad you're here, he says as we sit down at his kitchen table and watch him play with one of our favorite toys: an old-timey toy that looks like it was made by someone who had never seen anything before (he doesn't even know what they are). He's been playing for about five years now—and I've always wondered if this is just another kid doing something new or different every day? It might not be entirely clear how many kids have
The stool is about to fall over, so he’s probably going to fall on the floor.	 He doesn't know how long it will take for him and his friends (who are all in their late thirties or early sixties), but they've got a good chance of getting there soon enough. I'm not sure if I'll ever see you again, she says with an exasperated look that makes me feel like my heart has been ripped out by	 He doesn't know how long it will take for him and his friends (who are all in their late thirties or early sixties), but they've got a good chance of getting there soon enough. I'm not sure if I'll ever see you again, she says with an exasperated look that makes me feel like my heart has been ripped out by
His sister is holding up one hand as if she is waiting for him to pass her some of the cookies, and she’s holding a finger to her mouth as if to warn her brother to be quiet.	 I don't know what you're talking about, Elsa says with an annoyed look on his face; but it's not like I've ever been in this room before. She looks down at Anna who has just finished eating something that was left over from when they were both younger than two years old (she had no idea how much longer he could eat), then back into their own little world where there are so many different things happening around them every single day—and all these people have never even met each other or seen anyone else but themselves until now! The only thing standing between those three men right here? A girl named Kristoff whose name would make any sane person think twice after seeing Olaf walk through town without being noticed by	 I don't know what you're talking about, Elsa says with an annoyed look on his face; but it's not like I've ever been in this room before. She looks down at Anna who has just finished eating something that was left over from when they were both younger than two years old (she had no idea how much longer he could eat), then back into their own little world where there are so many different things happening around them every single day—and all these people have never even met each other or seen anyone else but themselves until now! The only thing standing between those three men right here? A girl named Kristoff whose name would make any sane person think twice after seeing Olaf walk through town without being noticed by
Meanwhile their mother is taking no notice.	 I don't know what you're talking about, she says, but it's not like I'm going to be the only one who gets hurt.	 I don't know what you're talking about, she says, but it's not like I'm going to be the only one who gets hurt.
She’s been doing the washing up and is now drying a plate.	 I'm not sure what to do with this, but it looks like she's done all that work for her own good (I don't know how much of an improvement there would be if we had more time together). If you have any questions or comments please email me at [email protected]	 I'm not sure what to do with this, but it looks like she's done all that work for her own good (I don't know how much of an improvement there would be if we had more time together). If you have any questions or comments please email me at [email protected]
She has left the tap running and the sink is overflowing.	 I'm not sure how long it will take me to get out of here, but at least we'll be back in a few hours or so! 	 I'm not sure how long it will take me to get out of here, but at least we'll be back in a few hours or so! 
There is a big puddle on the floor, and she’s standing in it.	 She doesn't know what to do with her hands or feet because they're too small for this sort of thing. I'm not sure if I should say that, he said as we walked away from his office at 9:30am., but there's no way you could have done anything about	 She doesn't know what to do with her hands or feet because they're too small for this sort of thing. I'm not sure if I should say that, he said as we walked away from his office at 9:30am., but there's no way you could have done anything about
She seems not to have noticed either the water or what her children are doing.	 I don't know if it's just me, but I've never seen anything like this in my life, she told The Huffington Post on Wednesday morning after a day of work at an office building that has been used by homeless people for more than 30 years and is now being converted into apartments with bathrooms so they can live out their daily lives without worrying about how much money will be taken from them	 I don't know if it's just me, but I've never seen anything like this in my life, she told The Huffington Post on Wednesday morning after a day of work at an office building that has been used by homeless people for more than 30 years and is now being converted into apartments with bathrooms so they can live out their daily lives without worrying about how much money will be taken from them
She might be looking out of the window, which is open and looks out on the garden.	 I don't know if it's a good idea to go in there at night or not because you're afraid that someone will come up with an excuse for what they've been doing all day long.	 I don't know if it's a good idea to go in there at night or not because you're afraid that someone will come up with an excuse for what they've been doing all day long.
You can see a path and another part of the house and the lawn, flowers, and a tree in the garden.	 It is very easy to get there if you are on your own or with someone who does not know where they live. I have never seen anything like this before, he said as we sat down for dinner at his family's home overlooking Lake Tahoe that overlooks San Jacinto National Park. It has been so long since I had any idea what it was all about but then one day my mother told me she would be coming back next year	 It is very easy to get there if you are on your own or with someone who does not know where they live. I have never seen anything like this before, he said as we sat down for dinner at his family's home overlooking Lake Tahoe that overlooks San Jacinto National Park. It has been so long since I had any idea what it was all about but then one day my mother told me she would be coming back next year
It seems to be summer, as she is wearing a short sleeved dress under her apron.	 She also has long black hair and blue eyes that look like they have been cut off from the rest of their body in some way or another (see below). She wears an orange jumpsuit with white stripes on both sides; it's not clear if this was done for any reason other than simply because there are so many people who wear these outfits at all times - but I'm sure	 She also has long black hair and blue eyes that look like they have been cut off from the rest of their body in some way or another (see below). She wears an orange jumpsuit with white stripes on both sides; it's not clear if this was done for any reason other than simply because there are so many people who wear these outfits at all times - but I'm sure
Her son is wearing shorts a shirt and shoes and socks, which are also falling down.	 He says that he has no idea what's going on in the house or how to get out of it.I don't know if I'm being honest with you, she tells me as we walk away from her home at about 10:30am (the next morning). It seems like they're just getting ready for their day off right now.They've been doing this all night long since last week when my dad	 He says that he has no idea what's going on in the house or how to get out of it.I don't know if I'm being honest with you, she tells me as we walk away from her home at about 10:30am (the next morning). It seems like they're just getting ready for their day off right now.They've been doing this all night long since last week when my dad
Her daughter is wearing a short skirt and T-shirt.	 I don't know what to say, she says, her voice cracking with emotion as I look down at my handiwork on the table in front of me. She's not sure how long it will be before we can talk about this or any other issues that have been plaguing	 I don't know what to say, she says, her voice cracking with emotion as I look down at my handiwork on the table in front of me. She's not sure how long it will be before we can talk about this or any other issues that have been plaguing
There are lots of cupboards all around the kitchen.	 It's a great place to hang out with friends and family, or if you're looking for something that will make your home look like it was built by someone who has never worked there before.	 It's a great place to hang out with friends and family, or if you're looking for something that will make your home look like it was built by someone who has never worked there before.
There are two cups on the draining board.	 The first cup is placed in a small bowl, and then it's poured into one of three bowls (one for each side). You can also use your fingers to gently pour some water over them as they're being drained or you could simply place an ice cube	 The first cup is placed in a small bowl, and then it's poured into one of three bowls (one for each side). You can also use your fingers to gently pour some water over them as they're being drained or you could simply place an ice cube
