sentence	control	dementia
There are two children and their mother in the kitchen.	 The first is a little girl, but she's not very good at playing with her own hands. I don't know what to make of that, I said as we sat down on my bed for an hour or so before he came back from his long-sleeved retreat into our living room (he was	 The first is a little girl, but she's not very good at playing with her own hands. I don't know what to make of that, I said as we sat down on my bed for an hour or so before he came back from his long-sleeved retreat into our living room (he was
The little boy has climbed up, on a three legged stool to get some cookies from the jar in the cupboard.	 He's not very good at it and I don't think he can do much of anything with his hands. I have no idea what you're talking about, she said as they sat down for an after-dinner meal that had just been ordered by her father (who was also there). The other two children were all sitting around their parents' table when we got back into our car: my sister who is now six months old; My brother whose first birthday will be early next year	 He's not very good at it and I don't think he can do much of anything with his hands. I have no idea what you're talking about, she said as they sat down for an after-dinner meal that had just been ordered by her father (who was also there). The other two children were all sitting around their parents' table when we got back into our car: my sister who is now six months old; My brother whose first birthday will be early next year
The stool is about to fall over, so he’s probably going to fall on the floor.	 I don't know if that's a good idea or not. I think it would be best for you and your family, she said in an almost-frowning voice as her eyes met with one of those red lips which had just been pulled out from under his arm when they were both looking at each other—a little more than two years after their first meeting was	 I don't know if that's a good idea or not. I think it would be best for you and your family, she said in an almost-frowning voice as her eyes met with one of those red lips which had just been pulled out from under his arm when they were both looking at each other—a little more than two years after their first meeting was
His sister is holding up one hand as if she is waiting for him to pass her some of the cookies, and she’s holding a finger to her mouth as if to warn her brother to be quiet.	 I don't know what you're talking about, he says in an almost impenetrable voice that sounds like it was made by someone who has never seen his face before (he's not even sure how this could have happened). But I can tell from my own experience: You are very good at making people do things with their hands when they need them most. He looks down on all those other children—the ones whose parents had been killed or maimed but were still alive after so many years without ever being found out! The only thing more important than seeing your family members die? It would make me feel much less guilty over having done something which no-one else did because we just didn�t want our kids	 I don't know what you're talking about, he says in an almost impenetrable voice that sounds like it was made by someone who has never seen his face before (he's not even sure how this could have happened). But I can tell from my own experience: You are very good at making people do things with their hands when they need them most. He looks down on all those other children—the ones whose parents had been killed or maimed but were still alive after so many years without ever being found out! The only thing more important than seeing your family members die? It would make me feel much less guilty over having done something which no-one else did because we just didn�t want our kids
Meanwhile their mother is taking no notice.	 I don't know what's going on, but I can tell you that the police are looking for a man in his 20s and he has not been found, she told The New York Times last year. The two men were taken into custody after an investigation	 I don't know what's going on, but I can tell you that the police are looking for a man in his 20s and he has not been found, she told The New York Times last year. The two men were taken into custody after an investigation
She’s been doing the washing up and is now drying a plate.	 I'm not sure what to do with this, but it looks like he's just getting out of his own way (I don't know if you can even call him that). The last thing we should be looking for are people who have no idea how they're being treated by their family or friends	 I'm not sure what to do with this, but it looks like he's just getting out of his own way (I don't know if you can even call him that). The last thing we should be looking for are people who have no idea how they're being treated by their family or friends
She has left the tap running and the sink is overflowing.	 I can't help but think that it's a good idea to have some sort of sink-in system in place, as this would be an excellent way for people who are just starting out on their new job (or even if they're already there). I'm not sure how you could do all	 I can't help but think that it's a good idea to have some sort of sink-in system in place, as this would be an excellent way for people who are just starting out on their new job (or even if they're already there). I'm not sure how you could do all
There is a big puddle on the floor, and she’s standing in it.	 I don't know how to get out of there. I'm not sure what you're talking about, he said with an expression that made me feel as if my heart had been beating for some time but was just too far away from being at this point (the only other person who could have done so	 I don't know how to get out of there. I'm not sure what you're talking about, he said with an expression that made me feel as if my heart had been beating for some time but was just too far away from being at this point (the only other person who could have done so
She seems not to have noticed either the water or what her children are doing.	 I don't know if it's a big deal, but I can tell you that they're very good at their job, she said in an interview with The New York Times last year and has since been named as one of its top 10 most-wanted women on social media (the other two being Gwyneth Paltrow who was recently fired by Facebook for 'dishonest' comments about	 I don't know if it's a big deal, but I can tell you that they're very good at their job, she said in an interview with The New York Times last year and has since been named as one of its top 10 most-wanted women on social media (the other two being Gwyneth Paltrow who was recently fired by Facebook for 'dishonest' comments about
She might be looking out of the window, which is open and looks out on the garden.	 I don't know if it's a good idea to go in there at night or not. I think you're right about that, he said as we walked by his house with our two young children who had just come home from their summer camp when they were all up for an afternoon walk-in (a little more than three hours). He was so excited after having been through this whole time without being able	 I don't know if it's a good idea to go in there at night or not. I think you're right about that, he said as we walked by his house with our two young children who had just come home from their summer camp when they were all up for an afternoon walk-in (a little more than three hours). He was so excited after having been through this whole time without being able
You can see a path and another part of the house and the lawn, flowers, and a tree in the garden.	 It's not that I don't want to be there, he said at one point during an interview with The New York Times about his new book: I have no idea what it is.	 It's not that I don't want to be there, he said at one point during an interview with The New York Times about his new book: I have no idea what it is.
It seems to be summer, as she is wearing a short sleeved dress under her apron.	 I don't know if it's just the weather or not, he says with an air of mystery in his voice that I have never heard from him before (he has no idea how long this will last). She looks up at me and then back down into my eyes: What do you mean by'snow-covered'? The other man takes another deep breath but does	 I don't know if it's just the weather or not, he says with an air of mystery in his voice that I have never heard from him before (he has no idea how long this will last). She looks up at me and then back down into my eyes: What do you mean by'snow-covered'? The other man takes another deep breath but does
Her son is wearing shorts a shirt and shoes and socks, which are also falling down.	 I don't know if he's going to be in the hospital or not, said one of his family members who has been with him for more than two years.	 I don't know if he's going to be in the hospital or not, said one of his family members who has been with him for more than two years.
Her daughter is wearing a short skirt and T-shirt.	 I don't know what to say, but it's not the first time I've seen this kind of thing in my life, she told The New York Times last year when asked if there was anything that could have made her feel more at home as an American or British woman who had	 I don't know what to say, but it's not the first time I've seen this kind of thing in my life, she told The New York Times last year when asked if there was anything that could have made her feel more at home as an American or British woman who had
There are lots of cupboards all around the kitchen.	 I don't know if it's a good idea to have one, but you can always go in and make some for your family or friends. I'm not sure what that would be like, she said as they sat down at her table with their hands on each other; but	 I don't know if it's a good idea to have one, but you can always go in and make some for your family or friends. I'm not sure what that would be like, she said as they sat down at her table with their hands on each other; but
There are two cups on the draining board.	 The first is a small, round-shaped piece of paper that you can use to hold your water and it's not too big or long for most people (I have one in my home). I've also used this as an unwanted cup	 The first is a small, round-shaped piece of paper that you can use to hold your water and it's not too big or long for most people (I have one in my home). I've also used this as an unwanted cup
