sentence	control	dementia
There are two children and their mother in the kitchen.	 I'm not sure what they're doing there, but it seems like a good place for them to be.	 I'm not sure what they're doing there, but it seems like a good place for them to be.
The little boy has climbed up, on a three legged stool to get some cookies from the jar in the cupboard.	 He's not sure how he got there but it looks like they've been working together ever since.) I don't know what you're talking about, I tell him as we sit down at one of our tables and start making out with each other before heading back into my room for another round or two more drinks (which are usually pretty good too). It was nice being here so soon after all these years. It is true that this place had its own unique flavor profile which made	 He's not sure how he got there but it looks like they've been working together ever since.) I don't know what you're talking about, I tell him as we sit down at one of our tables and start making out with each other before heading back into my room for another round or two more drinks (which are usually pretty good too). It was nice being here so soon after all these years. It is true that this place had its own unique flavor profile which made
The stool is about to fall over, so he’s probably going to fall on the floor.	 I don't know if that's a good thing or not. What do you mean by 'good'? she asked with an exasperated look in her eyes as they both looked at each other for what seemed like hours before finally settling back into their seats and letting go of one another without even looking up). I think it was just something we were doing together	 I don't know if that's a good thing or not. What do you mean by 'good'? she asked with an exasperated look in her eyes as they both looked at each other for what seemed like hours before finally settling back into their seats and letting go of one another without even looking up). I think it was just something we were doing together
His sister is holding up one hand as if she is waiting for him to pass her some of the cookies, and she’s holding a finger to her mouth as if to warn her brother to be quiet.	 I don't know what you're talking about, he says with an exasperated look on his face; but it's not like I've ever been in this situation before. He looks down at me from behind my back so that we can all see each other without being seen by anyone else or even knowing how many people are watching us through our windowless windows—the only way they could have known there was no such thing! They were too busy looking out over their own rooftops when someone suddenly came into view who had just walked past them while wearing nothing but white clothes…and then turned around after seeing everyone except themselves staring blankly straight ahead.) The man has always looked very different now than during those last few days: pale	 I don't know what you're talking about, he says with an exasperated look on his face; but it's not like I've ever been in this situation before. He looks down at me from behind my back so that we can all see each other without being seen by anyone else or even knowing how many people are watching us through our windowless windows—the only way they could have known there was no such thing! They were too busy looking out over their own rooftops when someone suddenly came into view who had just walked past them while wearing nothing but white clothes…and then turned around after seeing everyone except themselves staring blankly straight ahead.) The man has always looked very different now than during those last few days: pale
Meanwhile their mother is taking no notice.	 I don't know what you're talking about, she says, but it's not like I'm going to be the only one of those people who has a problem with this.	 I don't know what you're talking about, she says, but it's not like I'm going to be the only one of those people who has a problem with this.
She’s been doing the washing up and is now drying a plate.	 I'm not sure if it's just me or something else, but we're going to have some fun with that.	 I'm not sure if it's just me or something else, but we're going to have some fun with that.
She has left the tap running and the sink is overflowing.	 I'm not sure what to do next, but it seems like a good idea at this point in my life.	 I'm not sure what to do next, but it seems like a good idea at this point in my life.
There is a big puddle on the floor, and she’s standing in it.	 I don't know what to do about that, he said.I'm not sure if you've seen this before but there's no way we can stop her from getting out of here so quickly because they're going after us all over again.It looks like something has gone terribly wrong with our team right now	 I don't know what to do about that, he said.I'm not sure if you've seen this before but there's no way we can stop her from getting out of here so quickly because they're going after us all over again.It looks like something has gone terribly wrong with our team right now
She seems not to have noticed either the water or what her children are doing.	 I don't know if it's just me, but I've never seen anything like this in my life, she says with a smile that makes you feel as though your heart is beating faster than its usual pace.	 I don't know if it's just me, but I've never seen anything like this in my life, she says with a smile that makes you feel as though your heart is beating faster than its usual pace.
She might be looking out of the window, which is open and looks out on the garden.	 I don't know if it's a good idea to go in there or not, she said as we sat down at her kitchen table.I'm sure you'll find something that will make your head hurt more than anything else.You're right! he replied with an exasperated look across his face before turning away from me for another moment while my hands were still clasped tightly around him like they had never been	 I don't know if it's a good idea to go in there or not, she said as we sat down at her kitchen table.I'm sure you'll find something that will make your head hurt more than anything else.You're right! he replied with an exasperated look across his face before turning away from me for another moment while my hands were still clasped tightly around him like they had never been
You can see a path and another part of the house and the lawn, flowers, and a tree in the garden.	 It's not like you have to go through all that stuff, he told The Associated Press. You just know what it is.	 It's not like you have to go through all that stuff, he told The Associated Press. You just know what it is.
It seems to be summer, as she is wearing a short sleeved dress under her apron.	 I don't know if it's winter or not but I'm pretty sure we're in the middle of nowhere. Oh my God! You look like you've got something on your mind! She says with an amused smile that makes me feel good about myself for being so young and inexperienced at this point.)	 I don't know if it's winter or not but I'm pretty sure we're in the middle of nowhere. Oh my God! You look like you've got something on your mind! She says with an amused smile that makes me feel good about myself for being so young and inexperienced at this point.)
Her son is wearing shorts a shirt and shoes and socks, which are also falling down.	 He says that he has no idea what's going on in his head at the moment.I don't know if I've ever seen anything like this before or not, she tells me as we walk away from her house to get some food for our family of four children who have been living with their father since they were three years old.She adds: We're all very happy now because it means so much more than	 He says that he has no idea what's going on in his head at the moment.I don't know if I've ever seen anything like this before or not, she tells me as we walk away from her house to get some food for our family of four children who have been living with their father since they were three years old.She adds: We're all very happy now because it means so much more than
Her daughter is wearing a short skirt and T-shirt.	 I don't know what she's doing, but I'm going to be honest with you, he says in the video that has been viewed more than 1 million times on YouTube since it was posted last week by an anonymous user who identifies himself only as 'Jenny' (a pseudonym	 I don't know what she's doing, but I'm going to be honest with you, he says in the video that has been viewed more than 1 million times on YouTube since it was posted last week by an anonymous user who identifies himself only as 'Jenny' (a pseudonym
There are lots of cupboards all around the kitchen.	 It's a great place to go if you're looking for something that will make your life easier.	 It's a great place to go if you're looking for something that will make your life easier.
There are two cups on the draining board.	 The first one is used to drain water from a cup of coffee, which you can then pour into an ice cube or other container that's been placed in your freezer for at least 30 minutes before serving) and it will also help prevent mold growth (the second	 The first one is used to drain water from a cup of coffee, which you can then pour into an ice cube or other container that's been placed in your freezer for at least 30 minutes before serving) and it will also help prevent mold growth (the second
